"","reuniao","data","nome","funcao_blocoPar","BlocoParl","partido","estado","complemento","fala"
"1","17","2021-06-09","Omar Aziz","PRESIDENTE","(Omar Aziz. PSD - AM. Fala da Presidência.)","PSD","AM","Fala da Presidência","Bom dia a todos e a todas! Havendo número regimental, declaro aberta a 17ª Reunião da Comissão Parlamentar de Inquérito criada pelos Requerimentos 1.371, 1.372, de 2021, para apurar as ações e omissões do Governo Federal no enfrentamento da pandemia, bem como outras ações ou omissões cometidas por administradores públicos federais, estaduais e municipais, no trato com a coisa pública, durante a vigência da calamidade originada pela pandemia do coronavírus. A presente reunião destina-se à apreciação de requerimentos e ao depoimento do seu Antônio Elcio Franco, ex-Secretário-Executivo do Ministério da Saúde. Havendo número regimental, coloco em votação a Ata da 16ª Reunião, solicitando a dispensa de sua leitura. Os Srs. Senadores que aprovam permaneçam como se encontram.  Aprovada. Vou passar a palavra ao Relator, pra que a gente possa votar os requerimentos de informações, quebras de sigilos e convocações. Senador Otto Alencar. "
"2","17","2021-06-09","OTTO ALENCAR","(PSD - BA. Pela ordem.)","(PSD - BA. Pela ordem.)","PSD","BA","Pela ordem","Pela ordem, Sr. Presidente. Sr. Presidente, ontem das coisas importantes que não ficaram muito esclarecidas, porque houve um diálogo mais áspero entre o Ministro Marcelo Queiroga comigo... Às vezes acontece isso em CPI. Só quem não participou ainda que pode ignorar coisa dessa natureza num momento tão trágico que vive o povo brasileiro com essa situação de crise sanitária. E eu digo que foi importante pelo seguinte: porque, quando qualquer medicação ou vacina nova é lançada no mercado, é obrigação do médico ler a bula. Todos nós que somos profissionais de saúde, normalmente, sempre fazemos isso. Quando eu perguntei ao Ministro, eu pensei que ele tinha lido e, portanto, que poderíamos debater o assunto da vacina da Pfizer e da vacina AstraZeneca, porque está escrito na bula: AstraZeneca, 28 dias a segunda dose – depois da primeira dose, 28 dias; Pfizer, primeira dose, com 21 dias a segunda dose. O que aconteceu? Como o País não comprou as doses suficientes para fazer a vacinação e a segunda dose na data prevista e pré-estatuída na bula – de 21 dias, da Pfizer – se esticou pra 90 dias. Tudo bem. A primeira dose já dá uma imunidade; não a imunidade necessária pra não contrair a doença, mas dá. E se esticou pra segunda... Nesse intervalo de 90 dias, tudo pode acontecer, até porque não se tem previsão ainda de uma doença tão grave como essa de que a Medicina e a Ciência não conseguiram explicar ainda todas as manifestações clínicas. O que eu quis mostrar é que, naquele momento em que a Dra. Francieli Fantinato fez uma nota técnica e mandou para os Estados, para que parturientes pudessem tomar a segunda dose – e muitas mulheres foram a óbito –, eu queria dizer que isso é muito grave. E não consegui dizer, porque ele começou logo dizendo: ""Já vacinei 70 milhões de pessoas"". Não é assim. Será que uma vida não vale a pena? De uma senhora grávida que queria dar à luz? Não vale a pena se discutir e debater por que deu a segunda dose de forma...? – com imperícia, na minha opinião. Então, aquela norma editada pela Dra. Francieli, que não chegou sequer a assumir o cargo, foi retirada imediatamente depois do óbito. E, depois, o Ministro quis nomear a Dra. Luana Araújo, e o Governo não aceitou porque as posições dela são científicas, são sintonizadas com a ciência, com aquilo que é correto fazer numa doença dessa natureza.         Portanto, Sr. Presidente, diante desse fato, que é um fato grave, não se deu a segunda dose com 21 dias da Pfizer e 28 da AstraZeneca porque não tinha vacina pra dar. Aí se começou a dar a primeira dose e esticar, e dizer ""vacinamos 74 milhões de brasileiros"" com a primeira dose. A segunda dose... A primeira e a segunda dose, 10,8% até ontem. Isso significa 20 milhões de brasileiros, num país de 215 milhões de brasileiros. Era isso que eu queria explicar. E repetindo: todo médico tem que ler a bula. Não é Anvisa, não, senhor. É o médico. Por isso, eu fui ler a bula das vacinas, traduzi com dificuldade do inglês para o português, pra ler, pra saber e não dizer bobagem. Eu não posso me envolver numa coisa, numa discussão dessa sem ter consciência daquilo que eu estou falando. Por isso, Sr. Presidente, quero que V. Exa. aprecie este requerimento que faço aqui agora: requeiro, nos termos do art. 58, §3º, da Constituição Federal, e da Lei nº 1.579, de 1952, e do art. 148 do Regimento Interno do Senado Federal, a convocação da Dra. Francieli Fantinato, Coordenadora do Programa Nacional de Imunizações do Ministério da Saúde, para prestar depoimento perante esta Comissão Parlamentar de Inquérito como testemunha. Segundo o art. 153 do Regimento Interno do Senado Federal, combinado com o art. 229 do Código de Processo Penal, requeiro a convocação com vista à acareação entre testemunhas, da Dra. Luana Araújo e Dra. Francieli Fantinato, para prestar esclarecimento com relação à vacinação de gestantes. A Dra. Francieli Fantinato editou nota técnica aos Estados recomendando a vacinação de gestantes que tinham recebido a primeira dose da AstraZeneca com qualquer vacina que estivesse disponível, sem nenhuma comprovação de segurança ou eficiência disso em gestantes. Repetindo, Sr. Presidente: sem nenhuma comprovação de segurança ou eficácia disso em gestantes, o que levou a óbito, comprovado e reconhecido ontem aqui pelo Ministro Marcelo Queiroga. Quando eu perguntei a ele se a paciente foi a óbito, ele confirmou que foi. Não foi só uma paciente que, gestante, fez e foi vítima dessa imperícia do Ministério da Saúde. Qualquer vida vale a pena. São ali 477 mil óbitos, mas quem perdeu a mãe, quem perdeu o pai, os órfãos da CPI, as viúvas, os netos que perderam seus avós... Vale a pena se investigar para que, no relatório final, seja apreciado pelo conjunto dos Senadores para responsabilizar aqueles que, na negligência, na falta de atenção com a vida, levaram a óbito parte da população brasileira. Muito obrigado, e encaminho a V. Exa. "
"3","17","2021-06-09","Omar Aziz","PRESIDENTE","(Omar Aziz. PSD - AM)","PSD","AM","","Coloco extrapauta o pedido do Senador Otto Alencar. "
"4","17","2021-06-09","EDUARDO GIRÃO","(Bloco Parlamentar PODEMOS/PSDB/PSL/PODEMOS - CE)","Bloco Parlamentar PODEMOS/PSDB/PSL","PODEMOS","CE","","Sr. Presidente, pela ordem. "
"5","17","2021-06-09","Omar Aziz","PRESIDENTE","(Omar Aziz. PSD - AM)","PSD","AM","","Senador Izalci.  O senhor pediu a palavra? "
"6","17","2021-06-09","IZALCI LUCAS","(Bloco Parlamentar PODEMOS/PSDB/PSL/PSDB - DF. Pela ordem.)","Bloco Parlamentar PODEMOS/PSDB/PSL","PSDB","DF","Pela ordem","Está na pauta já, para a gente votar, o Requerimento 114, de ontem. Então, acho que vamos votar daqui a pouco, não é isso? "
"7","17","2021-06-09","Omar Aziz","PRESIDENTE","(Omar Aziz. PSD - AM)","PSD","AM","","Já, já. "
"8","17","2021-06-09","IZALCI LUCAS","(Bloco Parlamentar PODEMOS/PSDB/PSL/PSDB - DF)","Bloco Parlamentar PODEMOS/PSDB/PSL","PSDB","DF","","Está o.k. "
"9","17","2021-06-09","EDUARDO GIRÃO","(Bloco Parlamentar PODEMOS/PSDB/PSL/PODEMOS - CE)","Bloco Parlamentar PODEMOS/PSDB/PSL","PODEMOS","CE","","Pela ordem, Presidente. "
"10","17","2021-06-09","Omar Aziz","PRESIDENTE","(Omar Aziz. PSD - AM)","PSD","AM","","Senador Eduardo Girão. "
"11","17","2021-06-09","EDUARDO GIRÃO","(Bloco Parlamentar PODEMOS/PSDB/PSL/PODEMOS - CE. Pela ordem.)","Bloco Parlamentar PODEMOS/PSDB/PSL","PODEMOS","CE","Pela ordem","Rapidamente: a minha equipe tem sentido enormes dificuldades para acessar os documentos sigilosos. Eu não sei se isso está acontecendo aqui com os colegas.          "
"12","17","2021-06-09","Omar Aziz","PRESIDENTE","(Omar Aziz. PSD - AM)","PSD","AM","","Senador Eduardo Girão, todos nós. "
"13","17","2021-06-09","EDUARDO GIRÃO","(Bloco Parlamentar PODEMOS/PSDB/PSL/PODEMOS - CE)","Bloco Parlamentar PODEMOS/PSDB/PSL","PODEMOS","CE","","O fato... "
"14","17","2021-06-09","Omar Aziz","PRESIDENTE","(Omar Aziz. PSD - AM)","PSD","AM","","É que estão mandando todos os documentos como se fossem sigilosos. Nós vamos fazer uma quebra hoje. Nós não temos documentos... Documentos sigilosos, por exemplo, do Ministério das Relações Exteriores, tudo vem carimbado sigiloso, quando não é nada sigiloso. Tem documentos que estão no Portal da Transparência que a Secom mandou para cá como sigilosos. Então, nós vamos acabar com esse negócio, e hoje nós vamos aprovar aqui que não terá esses documentos sigilosos. A pessoa, quando mandar um documento sigiloso para cá, tem que dizer por quê, qual a razão para ser sigiloso; se não vier, nós vamos abrir. "
"15","17","2021-06-09","EDUARDO GIRÃO","(Bloco Parlamentar PODEMOS/PSDB/PSL/PODEMOS - CE)","Bloco Parlamentar PODEMOS/PSDB/PSL","PODEMOS","CE","","Tá. Deixa eu... "
"16","17","2021-06-09","Omar Aziz","PRESIDENTE","(Omar Aziz. PSD - AM)","PSD","AM","","Porque todos os documentos, para dificultar o acesso dos Senadores... Porque chega aqui... Já chegaram aí mais de 300 gigabytes, parece... Mais de 500 gigabytes. Nós não temos condições. Não é só o senhor, não; eu também. Os requerimentos que eu fiz... Eu estou com dificuldade de ter acesso. Pontualmente, a pessoa tem uma coisa ou outra, mas ninguém, nem os Senadores que fizeram os requerimentos de informação, o próprio Senador autor não está tendo acesso. Então, nós vamos fazer isso hoje, aqui, Senador, até porque o requerimento, quando um Senador pede, não é para ele só, é para a Comissão toda, está certo? Qualquer um pode ter acesso. "
"17","17","2021-06-09","ELIZIANE GAMA","(Bloco Parlamentar Senado Independente/CIDADANIA - MA)","Bloco Parlamentar Senado Independente","CIDADANIA","MA","","Sr. Presidente... "
"18","17","2021-06-09","EDUARDO GIRÃO","(Bloco Parlamentar PODEMOS/PSDB/PSL/PODEMOS - CE)","Bloco Parlamentar PODEMOS/PSDB/PSL","PODEMOS","CE","","Deixa eu só explicar os motivos rapidamente. "
"19","17","2021-06-09","Omar Aziz","PRESIDENTE","(Omar Aziz. PSD - AM)","PSD","AM","","O senhor tem razão. Eu só estou dando razão a V. Exa. "
"20","17","2021-06-09","EDUARDO GIRÃO","(Bloco Parlamentar PODEMOS/PSDB/PSL/PODEMOS - CE)","Bloco Parlamentar PODEMOS/PSDB/PSL","PODEMOS","CE","","O fato é que o drive que armazena esses registros frequentemente tem ficado inacessível. Apenas como exemplo, posso citar que, no dia de ontem, 8 de junho, ficou fora do ar aproximadamente de 9h da manhã até 11h30 e, durante a tarde, de 14h40 até às 15h30. Essas falhas de acesso têm imposto uma considerável perda de tempo, principalmente diante da enorme carga de documentos, das informações importantes, como o senhor colocou, que podem ser extraídas deles, no sentido de esclarecimento dos fatos relevantes ao desfecho desta CPI, principalmente em relação às possíveis malversações de verbas públicas federais repassadas a Estados e Municípios. Em tempo, eu gostaria de ressaltar, Presidente Omar, a dedicação da Secretaria desta Comissão, que, assim que é contatada, envida todos os esforços para resolver o problema da falta de acesso. Isso eu não posso negar. Porém, esse empenho da Comissão, da equipe de assessoria nossa aqui, tem sido totalmente paliativo, pois o problema se apresenta de forma reiterada. Pra finalizar, diante do exposto, eu venho requerer a V. Exa. que, em nome de colaborar com o melhor andamento dos trabalhos de todos os gabinetes que necessitam se debruçar sobre esse calhamaço de dados e informações, que se busque resolver em definitivo o problema técnico que ora se apresenta, até porque amanhã nós teremos o Governador aqui – espero que sim, o Governador do Amazonas –, e a gente está precisando acessar alguns dados do Amazonas para formular as nossas perguntas, o que atrapalha o trabalho da gente. Muito obrigado, Sr. Presidente. "
"21","17","2021-06-09","ELIZIANE GAMA","(Bloco Parlamentar Senado Independente/CIDADANIA - MA)","Bloco Parlamentar Senado Independente","CIDADANIA","MA","","Sr. Presidente, pra somar aqui. "
"22","17","2021-06-09","Omar Aziz","PRESIDENTE","(Omar Aziz. PSD - AM)","PSD","AM","","Nós estamos tendo dificuldades. Segundo a informação aqui, há um número excessivo de documentos, e parece que a capacidade... Tecnicamente, eu não entendo, Senador Girão, para eu lhe dar uma explicação... Eu estou pegando a explicação aqui. Eu já reclamei desse assunto. Eu estou tendo dificuldade também. "
"23","17","2021-06-09","ELIZIANE GAMA","(Bloco Parlamentar Senado Independente/CIDADANIA - MA)","Bloco Parlamentar Senado Independente","CIDADANIA","MA","","Sr. Presidente, só pra somar. "
"24","17","2021-06-09","Omar Aziz","PRESIDENTE","(Omar Aziz. PSD - AM)","PSD","AM","","Só um minutinho, Senadora Eliziane. "
"25","17","2021-06-09","ELIZIANE GAMA","(Bloco Parlamentar Senado Independente/CIDADANIA - MA)","Bloco Parlamentar Senado Independente","CIDADANIA","MA","","Tá. Tudo bem "
"26","17","2021-06-09","Omar Aziz","PRESIDENTE","(Omar Aziz. PSD - AM)","PSD","AM","","Passo já a palavra para a senhora. Eu estou tendo dificuldade também. É uma reclamação que o pessoal que está me ajudando... Pra ter informações, porque, sem informações, realmente...         Eu também espero que o Governador do Amazonas esteja aqui amanhã e que também todos os outros Governadores que nós convocamos estejam aqui. Eu vou... Ninguém tem mais interesse de que isso funcione mais rápido porque... As informações não são só para o senhor, mas para todos nós. Senadora Eliziane. "
"27","17","2021-06-09","ELIZIANE GAMA","(Bloco Parlamentar Senado Independente/CIDADANIA - MA. Pela ordem.)","Bloco Parlamentar Senado Independente","CIDADANIA","MA","Pela ordem","Presidente, é só para contribuir com relação à preocupação que o Senador Girão traz e V. Exa. coloca muito bem. É um volume, de fato, muito grande, Presidente – queria até agradecer a V. Exa. porque permitiu a uma representação feminina também esse acesso – , mas eu acho que seria muito importante, de repente, a gente ter um funcionário que pudesse trabalhar na divisão de temas, porque é um volume gigantesco, fica até inexequível você buscar isso, mesmo que você tenha lá um funcionário designado para isso. Acho que essa divisão em temas daria muito mais agilidade e efetividade na busca, de fato, dessas informações. Agora me parece até uma estratégia de quem enviou os documentos para cá como se fossem sigilosos, exatamente para criar uma confusão, para não ter acesso, por exemplo, a imprensa, que tem um papel muito importante de contribuição com esta CPI. Então, eles acabam também não tendo acesso. A gente não pode, por exemplo, trazer para cá esse documento para mostrar ao depoente, a gente não pode imprimir, tem uma série de limitações. Então, a gente precisa ter, de fato, esse olhar claro para evitar esse tipo de manobra, Presidente. "
"28","17","2021-06-09","Omar Aziz","PRESIDENTE","(Omar Aziz. PSD - AM)","PSD","AM","","Senador Renan por favor. "
"29","17","2021-06-09","RENAN CALHEIROS","(Bloco Parlamentar Unidos pelo Brasil/MDB - AL. Como Relator.)","Bloco Parlamentar Unidos pelo Brasil","MDB","AL","Como Relator","Presidente, eu acho muito importante... Nós estamos diante de um acumulado enorme de informações, o Senador Girão tem absoluta razão. E tem um pecado original: é que a maioria das informações chegam sob sigilo. A lei que estabelece o sigilo estabelece critérios. Esta Comissão Parlamentar de Inquérito, sob pena de prejudicar o aprofundamento da própria investigação, não pode concordar com a classificação ilegal, sem sustentação judicial, legal e formal para os sigilos que foram classificados. Então, por conta disso... Eu já falei com o Presidente Omar e queria pedir o apoio desta Comissão para nós reclassificarmos esses sigilos e deixarmos como sigilo apenas aquilo que a lei estabelece como sigilo, que é o que trata das informações bancárias, das informações fiscais, de assuntos de segurança nacional e de interesse do Estado brasileiro. Então, nós reclassificaríamos isso em função de uma classificação indevida. "
"30","17","2021-06-09","Omar Aziz","PRESIDENTE","(Omar Aziz. PSD - AM)","PSD","AM","","Só um exemplo: pedem-se informações da Secretaria de Comunicação para saber quais são os veículos que trabalham, e vem sigiloso. Desde quando isso é Lei de Segurança Nacional? Desde quando isso não é para a população saber? Eles mandam os documentos com a finalidade de a gente não chegar a usá-los. "
"31","17","2021-06-09","RANDOLFE RODRIGUES","(Bloco Parlamentar Senado Independente/REDE - AP)","Bloco Parlamentar Senado Independente","REDE","AP","","Informação sobre vacina vem como sigilosa! "
"32","17","2021-06-09","Omar Aziz","PRESIDENTE","(Omar Aziz. PSD - AM)","PSD","AM","","Informação sobre vacina, por exemplo: hoje eu soube através da imprensa – eu não sabia – que o Ministério das Relações Exteriores recebeu um comunicado do Embaixador da China pedindo para que tivéssemos cuidado porque teríamos problema com a Sinovac.  "
"33","17","2021-06-09","ELIZIANE GAMA","(Bloco Parlamentar Senado Independente/CIDADANIA - MA)","Bloco Parlamentar Senado Independente","CIDADANIA","MA","","Exatamente, ninguém sabe! Perfeito. "
"34","17","2021-06-09","Omar Aziz","PRESIDENTE","(Omar Aziz. PSD - AM)","PSD","AM","","Eu não sabia! Isso é sigiloso desde quando? Desde quando? Então, nós vamos fazer aqui... Aquilo que for realmente sujeito a sigilo fiscal, sigilo... Que possa ter problemas com a segurança nacional e de processos que estão sob sigilo na Justiça, desses nós manteremos o sigilo; dos outros, nós vamos abrir para todo mundo ter acesso.         "
"35","17","2021-06-09","EDUARDO GIRÃO","(Bloco Parlamentar PODEMOS/PSDB/PSL/PODEMOS - CE. Pela ordem.)","Bloco Parlamentar PODEMOS/PSDB/PSL","PODEMOS","CE","Pela ordem","Presidente, só para complementar, concordo plenamente com o senhor. Agora, tem dados também de investigações que estão tramitando aí na Polícia Federal, na CGU, e talvez seja necessário – acho que, pela legislação, são sigilosos mesmo –... "
"36","17","2021-06-09","Omar Aziz","PRESIDENTE","(Omar Aziz. PSD - AM)","PSD","AM","","Sim, sim, sim. "
"37","17","2021-06-09","EDUARDO GIRÃO","(Bloco Parlamentar PODEMOS/PSDB/PSL/PODEMOS - CE)","Bloco Parlamentar PODEMOS/PSDB/PSL","PODEMOS","CE","","... que a gente faça uma audiência fechada para ouvir essas autoridades importantes. Talvez isso seja importante também. "
"38","17","2021-06-09","Omar Aziz","PRESIDENTE","(Omar Aziz. PSD - AM)","PSD","AM","","Eu acho que... No momento em que V. Exa. tiver alguém que nós tenhamos que ouvir sigilosamente, não tenha dúvida de que isso será feito, até porque geralmente essas audiências realmente são coisas sigilosas. Então, vou colocar em votação essa questão de ordem do Senador Renan. "
"39","17","2021-06-09","RENAN CALHEIROS","(Bloco Parlamentar Unidos pelo Brasil/MDB - AL)","Bloco Parlamentar Unidos pelo Brasil","MDB","AL","","É o Requerimento 781, de 2021. "
"40","17","2021-06-09","Omar Aziz","PRESIDENTE","(Omar Aziz. PSD - AM)","PSD","AM","","Pode ler, por favor, Senador? "
"41","17","2021-06-09","RENAN CALHEIROS","(Bloco Parlamentar Unidos pelo Brasil/MDB - AL. Como Relator.)","Bloco Parlamentar Unidos pelo Brasil","MDB","AL","Como Relator","Requeiro, nos termos regimentais, a alteração da classificação de todos os documentos recebidos por esta Comissão Parlamentar de Inquérito e categorizados pela Coordenação de Comissões Especiais, Temporárias e de Inquérito da Secretaria-Geral da Mesa como sigilosos, reservados ou pessoais, à exceção exclusiva daqueles cuja confidencialidade decorra unicamente de lei eventualmente aplicável. Nesse sentido, longe de ter o presente requerimento o objetivo de criticar o trabalho dos servidores, sempre diligentes e atenciosos, mas cuida-se de pleito voltado à transparência plena e irrestrita das informações e documentos atinentes ao objeto investigativo desta Comissão. "
"42","17","2021-06-09","Omar Aziz","PRESIDENTE","(Omar Aziz. PSD - AM)","PSD","AM","","Em votação. Os que aprovam permaneçam como estão.  Aprovado. "
"43","17","2021-06-09","FERNANDO BEZERRA COELHO","(Bloco Parlamentar Unidos pelo Brasil/MDB - PE. Pela ordem.)","Bloco Parlamentar Unidos pelo Brasil","MDB","PE","Pela ordem","Presidente, está aprovado, mas eu gostaria apenas de que ficasse claro quem ficará com a responsabilidade dessa reclassificação. Tem que deixar claro... (Intervenção fora do microfone.) "
"44","17","2021-06-09","Omar Aziz","PRESIDENTE","(Omar Aziz. PSD - AM)","PSD","AM","","Não, nós só votamos a reclassificação em relação às questões sigilosas, porque estão todos os documentos chegando aqui, Senador Otto, sigilosos. (Intervenção fora do microfone.) "
"45","17","2021-06-09","Omar Aziz","PRESIDENTE","(Omar Aziz. PSD - AM)","PSD","AM","","Não, querido, o seu requerimento ainda vai ser votado. Nós só votamos essa questão da reclassificação. "
"46","17","2021-06-09","MARCOS ROGÉRIO","(Bloco Parlamentar Vanguarda/DEM - RO)","Bloco Parlamentar Vanguarda","DEM","RO","","Pela ordem, Presidente. "
"47","17","2021-06-09","Omar Aziz","PRESIDENTE","(Omar Aziz. PSD - AM)","PSD","AM","","Pois não, Senador. "
"48","17","2021-06-09","MARCOS ROGÉRIO","(Bloco Parlamentar Vanguarda/DEM - RO. Para questão de ordem.)","Bloco Parlamentar Vanguarda","DEM","RO","Para questão de ordem","Sr. Presidente, eu apresento, na verdade, uma questão de ordem a V. Exa., nos termos do 403 e seguintes do Regimento Interno do Senado Federal, e com base no que estabelecem os arts. 108 §1º, e 412, IV e IX. É uma questão de ordem para arguir sobre a repetida prática antirregimental de alteração intempestiva da pauta desta Comissão Parlamentar de Inquérito. De fato, apesar das reiteradas solicitações que fazemos a esta Comissão, novamente foi divulgada, em um prazo inferior a dois dias úteis, ao arrepio do que determina o §1º do art. 108 do Regimento Interno, uma nova pauta para a reunião deliberativa de hoje, dia 9 de junho, com significantes modificações. Efetivamente, até a data de ontem, dia 8 de junho, estavam pautados outros requerimentos. Ocorre que V. Exa., sem qualquer aviso, consulta ou justificativa, acrescentou novos requerimentos para serem apreciados nesta reunião e retirou outros requerimentos. É preciso deixar claro, Sr. Presidente, que os trabalhos da Comissão precisam ser transparentes. Essas alterações surpresa minam não apenas a confiança dos Senadores e da população que nos acompanha, como representam entraves ao bom andamento das atividades da Comissão. Ora, acredito que as reiteradas mudanças de pauta, a grande maioria fora do prazo regimental e sem que os membros da Comissão sequer sejam consultados sobre tais alterações, violam frontalmente o exercício do mandato dos Parlamentares e são mesmo passíveis de nulidade, na forma do 412, incisos IV e XI, do Regimento Interno do Senado Federal.         É nesse sentido, Sr. Presidente, com todo respeito, que não peço nada além do cumprimento do nosso Regimento, que é a norma que deve orientar o trabalho desta CPI, bem como a observância do tratamento adequado e da cortesia que merecem os membros da Comissão, para que possamos levar a cabo a nossa missão da melhor forma possível. São só de convocações, Sr. Presidente – porque há um acordo entre nós em relação aos requerimentos de solicitação de informações; quanto a esses, não há objeção, porque nós pactuamos isso... Numa outra questão de ordem, V. Exa. fez questão de mencionar que estava acatando esses pedidos nessa direção, como fruto também desse entendimento e no cumprimento do chamado devido processo legislativo. Hoje, todavia, constam sete requerimentos de convocação; na verdade, oito. Se considerarmos o que o Senador Otto Alencar apontou agora há pouco, seriam oito requerimentos de convocação sem que estivessem pautados no prazo regimental. Faço um apelo a V. Exa. Não há concordância com convocação sem que se obedeça ao devido prazo regimental. É o apelo que faço a V. Exa. neste momento. "
"49","17","2021-06-09","ELIZIANE GAMA","(Bloco Parlamentar Senado Independente/CIDADANIA - MA)","Bloco Parlamentar Senado Independente","CIDADANIA","MA","","Para contraditar, Presidente. "
"50","17","2021-06-09","Omar Aziz","PRESIDENTE","(Omar Aziz. PSD - AM)","PSD","AM","","Só um minutinho. Senadora Eliziane. "
"51","17","2021-06-09","ELIZIANE GAMA","(Bloco Parlamentar Senado Independente/CIDADANIA - MA. Pela ordem.)","Bloco Parlamentar Senado Independente","CIDADANIA","MA","Pela ordem","Sr. Presidente, eu queria cumprimentar o meu colega Senador Marcos. Ele faz referência, de fato, ao Regimento, que fala do prazo de 48 horas, mas é bom lembrar que nós estamos em um período excepcional, portanto, num período de pandemia. E o mesmo Regimento, no art. 108, §1º, é claro quando fala a exceção: ""salvo em caso de urgência"". Então, nós estamos aqui cobertos pelo Regimento da Casa, dentro da normativa interna e, considerando uma CPI, que é uma Comissão Parlamentar de Inquérito, temporária, temos apenas 90 dias – V. Exa. não sei se vai prorrogar, mas tem demonstrado, de forma muito clara, para todos que não pretende prorrogar esta Comissão. Portanto, estamos cobertos, Presidente, pelo Regimento na aprovação desses requerimentos. "
