"","reuniao","data","nome","funcao_blocoPar","BlocoParl","partido","estado","complemento","fala"
"493","46","2021-08-19","LUIS CARLOS HEINZE","(Bloco Parlamentar Unidos pelo Brasil/PP - RS)","Bloco Parlamentar Unidos pelo Brasil","PP","RS","","O.k., Senador, mas eu estou falando no meu caso. Da mesma forma que saiu ontem, e casualmente pelo mesmo jornal... Alguém tem ligação desta Comissão com o jornal ou com a fonte a que estão passando lá. Com relação ao caso específico, o Senador Wellington Fagundes – vou repetir o que eu disse ontem – me convidou, ainda na Comissão Covid, Senador – e aqui está o Senador Izalci, que fazia parte também, como o Senador Confúcio Moura –, para que nós pudéssemos trabalhar primeiro o projeto dele, do Senador Wellington Fagundes, que é um excelente projeto, votado por unanimidade na Câmara e no Senado Federal, onde começou esse processo, para que quatro grandes laboratórios brasileiros que fabricam medicamentos veterinários pudessem fabricar também medicamentos humanos. Foi um debate intenso. Isso aconteceu, e nós participamos.         Com relação à ligação, Senador Girão, se pegar o meu telefone, tem milhares de ligações – milhares! –, em que se trata desse e de tantos assuntos diretamente ligados à questão covid, de que nós estamos tratando em inúmeras situações. Para primeiro debater esse processo, eu consultei doutores, especialistas do meu Estado, na universidade PUC, para saber deles se seria viável ou não. Eu digo: não vou falar do assunto, porque, daqui a pouco, pode ter algum problema. E me aconselharam que os laboratórios são de altíssima segurança. O Senador Izalci, inclusive, lembra – participamos com ele, porque era do PSDB – reuniões que fizemos com o Senador Confúcio, com o Senador Izalci, com o Senador Nelsinho Trad e com o próprio Senador Wellington com o Butantan. Queríamos ali acertar, porque estava havendo a briga entre Doria e Bolsonaro. Esse foi o interesse da nossa reunião. Isso foi feito para que nós pudéssemos fazer com que esses laboratórios pudessem também fabricar vacinas, e a negociação era com o Butantan especificamente para aproximar. Foi feito isso, trabalhei. Desde abril de 2020, meu gabinete tem se dedicado incansavelmente à busca de alternativa de remédios para combater a covid-19, além de buscar vacinas. Não aceito o fato de negligenciarmos as experiências de médicos mundialmente renomados e com experiência prévia de combate às viroses que disponibilizam tratamentos com remédios reposicionados. O tratamento precoce com remédios off-label é resultado de estudos realizados por cientistas renomados, com qualificação na área de virose. Cito aqui Satoshi Omura, Didier Raoult, Peter McCullough, Tess Lawrie, entre tantos outros, que têm publicado, de forma consistente e incansável, metanálises, estudos randomizados, duplo-cego, tanto com ivermectina como com hidroxicloroquina, mas, assim mesmo, a mídia e a indústria farmacêutica insistem em não apenas negligenciar tais estudos como também em perseguir e tentar denegrir a imagem de cientistas. E, como sou defensor da ciência e da liberdade dos médicos de prescreverem remédios reposicionados para tentar combater o covid-19, também sou alvo de tentativa de perseguição e de calúnias e difamação. Estas tentativas de me calar não obterão êxito algum. Ao contrário, indicam que eu estou incomodando interesses que são alheios à realidade do drama humano e à busca de alternativas de tratamento. Nesse sentido, venho destacar a publicação em revista científica de metanálise publicada na Inglaterra, envolvendo a ivermectina, que verificou a redução, Senador Girão – que nós defendemos juntos –, da carga viral nos primeiros cinco dias de infecção, levando à redução do impacto da doença. Também sobre a metanálise publicada sobre hidroxicloroquina na Califórnia, Estados Unidos, em pacientes expostos à covid-19, em fase inicial da infecção, foi demonstrada a redução da infecção. Aqui está a publicação dos Estados Unidos, aqui está a publicação da Inglaterra. Metanálise não é chute. Esta CPI chama de charlatões os médicos que têm se dedicado aos estudos de tratamento precoce, e eu conclamo esta CPI a trazer médicos de verdade, que tragam resultados da ineficácia do tratamento em pacientes em fase inicial de infecção. Ainda sobre médicos que são autoridades e que são perseguidos, está o Dr. Zelenko, candidato a Nobel da Paz. É autor de diversos trabalhos e protocolos. O médico que criou o protocolo de tratamento precoce para covid-19 com hidroxicloroquina, zinco, azitromicina foi indicado ao Prêmio Nobel da Paz.         Em entrevista, Senador Girão... Pasmem! Em entrevista, declarou: ""Posso dar razões pelas quais há resistência. É muito simples, chama-se política [que estamos debatendo neste instante aqui], lucro, arrogância e medo"". E chamou categoricamente os negadores da eficácia da hidroxicloroquina e do zinco de culpados de assassinato em massa. Será que a falsa narrativa agora será a de que o candidato a Prêmio Nobel da Paz não tem credibilidade ou algo parecido? Nós vamos aguardar. Tenho contatos internacionais com médicos do Chile, da Itália, dos Estados Unidos, do chamado Grupo Hipócrates. Esses medicamentos são responsáveis, sim, somados às vacinas aplicadas, pelas 19.362.990 vidas salvas. E também, Senador Renan, no caso do tratamento e da vacina – vacina e tratamento –, a letalidade, no Brasil, está em 2,8; na Rússia, em 2,6. No Brasil, nós criminalizamos o tratamento, Senador Girão. Enquanto isso, a Índia, que não o criminaliza, que faz tratamento e vacina e que tem um percentual muito menor de pessoas vacinadas do que o Brasil, apesar de ser a primeira em vacina – a China é a primeira em vacina no mundo; a segunda é a Índia –, tem a letalidade de 1,3, porque adota o tratamento precoce e adota a vacinação. A Nigéria, que faz a mesma coisa, tem 1,2, e a Coreia do Sul, 1,0. Estou citando dados de que estamos falando aqui. Da mesma forma, Sr. Presidente, Sr. Relator, colegas Parlamentares, já citei e vou repetir: esse fato... Quando Didier Raoult, um cientista, fala desse assunto – foi o primeiro mundialmente a falar desse assunto na França –, a big pharma, Senador Renan e Senador Girão, foi para cima dele na Índia. Aqui mesmo, nesta Comissão, fizeram fake news desse senhor, um cientista, porque ele teve peito e disse que era uma gripezinha e curava com cloroquina. Na sequência, o Presidente Trump usou esse fato nos Estados Unidos. Da mesma forma, foi motivo de guerra durante a eleição Biden e Trump. Quando o Presidente Bolsonaro fala desse mesmo tema aqui, no Brasil, estamos assistindo a esta CPI, que – o Senador Renan afirmou, e concordo com o Senador Renan – está corroendo a imagem do Presidente, porque ele teve a coragem de adotar um tratamento precoce barato. Não é que ele o recomendasse. Eu e o Girão não recomendamos. Girão, quem recomenda são os médicos. Mas advogamos esse tratamento, e esse, sim, ajudou a salvar milhares de vidas. "
"494","46","2021-08-19","RENAN CALHEIROS","(Bloco Parlamentar Unidos pelo Brasil/MDB - AL)","Bloco Parlamentar Unidos pelo Brasil","MDB","AL","","Mas eu afirmei isso aqui? Não. "
"495","46","2021-08-19","LUIS CARLOS HEINZE","(Bloco Parlamentar Unidos pelo Brasil/PP - RS)","Bloco Parlamentar Unidos pelo Brasil","PP","RS","","Foi falado várias vezes na CPI que o Bolsonaro recomendava. Eu estou falando do fato mundialmente conhecido. "
"496","46","2021-08-19","RENAN CALHEIROS","(Bloco Parlamentar Unidos pelo Brasil/MDB - AL)","Bloco Parlamentar Unidos pelo Brasil","MDB","AL","","Eu falo com relação à erosão da popularidade. Eu não tratei disso aqui. "
"497","46","2021-08-19","LUIS CARLOS HEINZE","(Bloco Parlamentar Unidos pelo Brasil/PP - RS)","Bloco Parlamentar Unidos pelo Brasil","PP","RS","","O.k.! Mas estou falando – estou falando – na Índia, na França, estou falando nos Estados Unidos, estou falando do Brasil. Aqui o fato foi politizado, como nos Estados Unidos foi politizado, como na França foi politizado. E também o grande interesse econômico... O depoente aqui sabe, trabalha com vacina, que esse tema hoje, esse mercadinho deve ser de aproximadamente US$100 bilhões. E o tratamento precoce custa R$60, R$70, quando o remdesivir custa alguns milhares de reais – remdesivir. Aqui mesmo, nesta CPI, eu citei e desafio qualquer um a dizer ao contrário. A Pfizer, que tem vacina, já está apresentando um medicamento que está em discussão e para registro. Vai preconizar o quê, Senador Girão? Tratamento precoce e vacina com produto deles. Por que não posso usar estes aqui?         Então, esse é o fato, Senador Presidente, colegas Senadores e Senadoras, da minha indignação. E vou demonstrar, com o caso Fauci, nos Estados Unidos, o grande interesse da big pharma em cima dessa questão, porque é criminoso esse fato. Esse é o fato. Essa é a fala. E a minha indignação está reposta nesta Comissão pelo vazamento de informações que a Comissão deu do meu caso. Não tenho nada a ver com o depoente ou com quem quer que seja. Desafio esta CPI ou quem quer que seja. Disse ontem e repito hoje: sofri calúnia, sofri difamação – meus familiares, meus amigos – em caso de corrupção ainda nos governos passados. Levei 914 dias. Fui inúmeras vezes... Desafiei a Polícia Federal, desafiei o Ministério Público Federal, em mais de 40 vezes que fui lá, cobrando deles uma definição. Não devo nada. Não devia nada e não devo. E foi reposta a minha posição. Da mesma forma, nesse caso aqui. Não aceito vazamento. E, quanto a essas informações, já pedi o direito de resposta à Folha de S.Paulo. Da mesma forma, estou ingressando para que esta Comissão, Sr. Presidente, possa ver de onde vazam essas informações. Nesse meu caso, eu vou até as últimas consequências. Não aceito. Se eu sou candidato ou não sou a nada, não me interessa. Tenho mandato, Senador Renan, por mais seis anos. Não é à toa que fiz 2,317 milhões de votos no Rio Grande do Sul. As pessoas confiam em mim pela minha seriedade, pelo meu trabalho. Não vou aceitar chacotas aqui porque eu defendo um tratamento. E vou provar, Senador Renan, vou provar – você vai fazer o seu relatório –, nós vamos fazer a demonstração de que esse tratamento funciona, como estão mostrando as pesquisas realizadas com duplo-cego, randomizado. Essas pesquisas mostram e, quando citam dados do Brasil, citam o caso de Serrana, São Paulo. Com a população, em janeiro desse ano, totalmente vacinada, 100% vacinada, comparei com Porto Feliz, na mesma São Paulo, com população 30%, 40% vacinada. O resultado do tratamento precoce em Porto Feliz, do tratamento precoce em Serrana, com 100% da vacinação feita. E, dessa forma, não é à toa que, no Brasil, em julho, mais de 1,7 mil Municípios não registraram um caso de morte. E será consequência de que esse tratamento está servindo. Já liberamos, até ontem, 207 milhões de doses e já aplicamos 169 milhões de doses. Infelizmente, Senador Renan, o Governo vende mal essas questões e até Governadores, como disse aqui, se aproveitam da vacina que vai do Governo Federal como se fosse deles. Portanto, é o meu relato. Muito obrigado, Sr. Presidente. "
"498","46","2021-08-19","Randolfe Rodrigues","PRESIDENTE","(Randolfe Rodrigues. PDT/CIDADANIA/REDE/REDE - AP)","REDE","AP","","Obrigado, Senador Heinze. Só para tranquilizar a todos, assim, só para deixar claro para todos: a Constituição assegura para todos os Parlamentares a inviolabilidade da opinião, palavra e voto, que está prevista no art. 53 da Constituição. Nós temos sido muito questionados sobre posições que são defendidas aqui, mas cada Senador eleito pelos cidadãos do seu Estado tem autonomia para manifestar as suas posições. O Senador expressou as posições que tem em relação à hidroxicloroquina, ivermectina e outros, de que eu, particularmente, divirjo. E fico feliz em saber que vai ter uma outra proposta de relatório ao relatório que vai ser apresentado pelo Senador Renan Calheiros. É importante, porque talvez, assim, nós tenhamos confrontados dois tipos de posições: os que defendem o uso de máscaras, álcool em gel, vacina; e os que defendem hidroxicloroquina, ivermectina e o que mais... "
"499","46","2021-08-19","LUIS CARLOS HEINZE","(Bloco Parlamentar Unidos pelo Brasil/PP - RS)","Bloco Parlamentar Unidos pelo Brasil","PP","RS","","Eu defendo as duas coisas, Sr. Presidente: a vacina... "
"500","46","2021-08-19","Randolfe Rodrigues","PRESIDENTE","(Randolfe Rodrigues. PDT/CIDADANIA/REDE/REDE - AP)","REDE","AP","","Prosseguindo, Senador... "
"501","46","2021-08-19","LUIS CARLOS HEINZE","(Bloco Parlamentar Unidos pelo Brasil/PP - RS)","Bloco Parlamentar Unidos pelo Brasil","PP","RS","","... a vacina... "
"502","46","2021-08-19","Randolfe Rodrigues","PRESIDENTE","(Randolfe Rodrigues. PDT/CIDADANIA/REDE/REDE - AP)","REDE","AP","","... Tasso Jereissati... "
"503","46","2021-08-19","LUIS CARLOS HEINZE","(Bloco Parlamentar Unidos pelo Brasil/PP - RS)","Bloco Parlamentar Unidos pelo Brasil","PP","RS","","... a vacina... "
"504","46","2021-08-19","Randolfe Rodrigues","PRESIDENTE","(Randolfe Rodrigues. PDT/CIDADANIA/REDE/REDE - AP)","REDE","AP","","... pelo sistema remoto. "
"505","46","2021-08-19","LUIS CARLOS HEINZE","(Bloco Parlamentar Unidos pelo Brasil/PP - RS)","Bloco Parlamentar Unidos pelo Brasil","PP","RS","","... e também o tratamento precoce. Defendo as duas coisas. "
"506","46","2021-08-19","Randolfe Rodrigues","PRESIDENTE","(Randolfe Rodrigues. PDT/CIDADANIA/REDE/REDE - AP)","REDE","AP","","Prosseguindo, Senador Tasso no sistema remoto. Esse é o debate que com certeza nós teremos: vacina versus hidroxicloroquina.         Vamos lá. Senador Tasso, a palavra com V. Exa. "
"507","46","2021-08-19","TASSO JEREISSATI","(Bloco Parlamentar PODEMOS/PSDB/PSL/PSDB - CE. Para interpelar. Por videoconferência.)","Bloco Parlamentar PODEMOS/PSDB/PSL","PSDB","CE","Para interpelar Por videoconferência","Presidente Randolfe, Senador Renan, Sr. Maximiano, já no depoimento da Sra. Emanuela, eu tinha feito uma pergunta que eu acho fundamental para clarear alguns problemas da relação da Precisa com o Ministério da Saúde e com a Bharat, em que eu perguntei – e agora o Senador Renan voltou a afirmar – sobre o sistema de remuneração estabelecido na negociação entre V. Sa. e a Bharat, já que V. Sa., como foi dito aqui, esteve várias vezes na Índia, e evidentemente que essas viagens todas, com esse grupo de pessoas, não foram para tratar de um contrato em que não havia sistema de remuneração. Não estou pedindo aqui que V. Sa. revele o número absoluto, mas o sistema de remuneração era por dose vendida, era percentual sobre o valor, era, enfim, qualquer outro tipo de compensação? Mas isso é obrigatório em qualquer contrato entre duas empresas que comercializam determinado produto e uma representa a outra. É simplesmente obrigatório. Eu gostaria de saber se V. Sa., até porque a Dra. Emanuela disse aqui que ela não poderia revelar porque prejudicaria o andamento da negociação. Essa negociação já foi interrompida, então não existe mais razão e não vejo em que essa resposta poderia encaminhar. Poderia responder, por favor? "
"508","46","2021-08-19","Randolfe Rodrigues","PRESIDENTE","(Randolfe Rodrigues. PDT/CIDADANIA/REDE/REDE - AP)","REDE","AP","","Por gentileza. "
"509","46","2021-08-19","FRANCISCO EMERSON MAXIMIANO","(Para depor.)","(Para depor.)","(Para depor.)","(Para depor.)","(Para depor","Sr. Senador, eu me reservo o direito de não responder essa pergunta e permanecer em silêncio. "
"510","46","2021-08-19","TASSO JEREISSATI","(Bloco Parlamentar PODEMOS/PSDB/PSL/PSDB - CE)","Bloco Parlamentar PODEMOS/PSDB/PSL","PSDB","CE","","Eu acho muito estranho que revelar um sistema de remuneração leve a incriminar alguém. Qualquer contrato desse é público. O que incrimina, ao meu ver, Senador Randolfe, é o fato de um contrato de representação comercial sem nenhum sistema de remuneração. Isso é altamente incriminador e revela realmente uma negociação que se torna extremamente nebulosa para todos nós. Eu lhe pergunto: o senhor conhece Marcos Tolentino? "
"511","46","2021-08-19","FRANCISCO EMERSON MAXIMIANO","","","","","","Sim, Sr. Senador. "
"512","46","2021-08-19","TASSO JEREISSATI","(Bloco Parlamentar PODEMOS/PSDB/PSL/PSDB - CE)","Bloco Parlamentar PODEMOS/PSDB/PSL","PSDB","CE","","O senhor conhece Danilo Trento? "
"513","46","2021-08-19","FRANCISCO EMERSON MAXIMIANO","","","","","","Sim. "
"514","46","2021-08-19","TASSO JEREISSATI","(Bloco Parlamentar PODEMOS/PSDB/PSL/PSDB - CE)","Bloco Parlamentar PODEMOS/PSDB/PSL","PSDB","CE","","O senhor conhece Ricardo Benetti? "
"515","46","2021-08-19","FRANCISCO EMERSON MAXIMIANO","","","","","","Não me ocorre quem exatamente seja. "
"516","46","2021-08-19","TASSO JEREISSATI","(Bloco Parlamentar PODEMOS/PSDB/PSL/PSDB - CE)","Bloco Parlamentar PODEMOS/PSDB/PSL","PSDB","CE","","Ricardo Barros aqui V. Sa. já declarou que conhece.         Eu venho da área comercial, minha vida toda foi começada na área comercial e, pela primeira vez, eu estou vendo esse tipo de negociação em que não existe remuneração. Até porque chegou um comunicado, se não me engano da Bharat Biotech, aqui na CPI, dizendo que não tratou de... (Falha no áudio.) ... como eles falam em inglês. O Senador Renan levantou um ponto interessante, já que não existe e o senhor, com certeza, sua empresa, já gastou uma fortuna com viagens à Índia, comitivas, etc., etc. Então, o Senador Renan levantou um ponto importante. A mesma coisa eu pergunto, que é muito estranho, a fiança do FIB Bank. O senhor, evidentemente, conhece o FIB Bank. A minha pergunta é: por qual razão a sua empresa não procurou aquilo que é normal também nesse tipo de negociação, principalmente se tratando de uma negociação com um ente público como o Ministério da Saúde, Governo Federal, uma fiança bancária com os bancos conhecidos do mercado, que, diante do contrato que V. Sa. tinha à mão, com certeza dariam, teriam todas as condições de dar, e foi procurar uma empresa completamente desconhecida no mercado financeiro, no mercado de transações financeiras no País e que tinha uma série de problemas? Por que razão? "
"517","46","2021-08-19","FRANCISCO EMERSON MAXIMIANO","","","","","","Sr. Senador, eu vou exercer o direito ao silêncio. "
"518","46","2021-08-19","TASSO JEREISSATI","(Bloco Parlamentar PODEMOS/PSDB/PSL/PSDB - CE)","Bloco Parlamentar PODEMOS/PSDB/PSL","PSDB","CE","","Então, eu vou lhe dizer a razão que eu acho. O FIB Bank, pelas pesquisas que nós fizemos e justamente intrigados com isso, primeiro, ele não é banco, já foi dito aqui, não se trata de banco e, quando ele bota o nome bank, eu descobri que quando se bota bank, em inglês, ele pode ser usado ou não. (Intervenção fora do microfone.) "
"519","46","2021-08-19","TASSO JEREISSATI","(Bloco Parlamentar PODEMOS/PSDB/PSL/PSDB - CE)","Bloco Parlamentar PODEMOS/PSDB/PSL","PSDB","CE","","Não, porque ele não é registrado no Banco Central, não segue a nenhum tipo de fiscalização ou normalização do Banco Central. Ele é uma sociedade estranha que também chama atenção de qualquer pessoa que tenha qualquer contato com o mundo comercial, porque ele tem um capital integralizado de 7,5 bilhões. Evidente que uma empresa que tem um capital de 7,5 bilhões deve ter acionistas fortíssimos porque já colocaram ali, dentro das empresas, 7,5 bilhões. No entanto, nós fomos pesquisar exatamente o que seria esse capital integralizado, ou seja, capital já colocado, e verificamos que boa parte desse capital, cerca de 7,2 bilhões, foi colocado como... através de um imóvel gigantesco em Curitiba, cujos donos do imóvel, cujos acionistas são Pico do Juazeiro e MB Guassu. O senhor conhece essas duas empresas que são as acionistas do FIB Bank?         "
"520","46","2021-08-19","FRANCISCO EMERSON MAXIMIANO","","","","","","Não, Sr. Senador. "
"521","46","2021-08-19","TASSO JEREISSATI","(Bloco Parlamentar PODEMOS/PSDB/PSL/PSDB - CE)","Bloco Parlamentar PODEMOS/PSDB/PSL","PSDB","CE","","Essas duas empresas... Uma delas integralizou o seu capital através desse terreno gigantesco em Curitiba. Nós fomos verificar a existência desse terreno, e esse terreno simplesmente não existe e não pertence a essa empresa. A Pico do Juazeiro, que é outra dessas sócias, donas do FIB Bank, também não tem uma vida bem clara, declarada e conhecida em registros na junta comercial, etc., etc. A pergunta é: por que razão... Vou voltar a perguntar se V. Sa. não tinha conhecimento de nenhum desses problemas do FIB Bank. "
"522","46","2021-08-19","FRANCISCO EMERSON MAXIMIANO","","","","","","Não, senhor. "
"523","46","2021-08-19","TASSO JEREISSATI","(Bloco Parlamentar PODEMOS/PSDB/PSL/PSDB - CE)","Bloco Parlamentar PODEMOS/PSDB/PSL","PSDB","CE","","V. Exa., então, recorreu à fiança de uma empresa que V. Exa. não conhecia, não procurou saber... E o mais curioso, Senador Randolfe, Senador Renan, é que o Ministério da Saúde também... O Ministério da Saúde... Só pode alguém apresentar ao Ministério da Saúde uma empresa fajuta... Farsa, esta é uma das maiores farsas que eu já vi na minha vida comercial: uma empresa com capital de 7,5 bilhões, que foram integralizados através de terrenos que não existem. Então, é muita segurança... Desculpe aqui, como V. Sa. tem dito aí, com todo o respeito, é muita cara de pau oferecer ao Ministério da Saúde uma empresa dessas como garantidora de um capital, de um volume de recursos desse tamanho. Realmente não existe isso. V. Sa. poderia dizer qual foi a taxa cobrada pelo FIB Bank pela fiança bancária dada à Precisa? "
"524","46","2021-08-19","FRANCISCO EMERSON MAXIMIANO","","","","","","Sr. Senador Jereissati, eu vou exercer o direito ao silêncio. "
"525","46","2021-08-19","TASSO JEREISSATI","(Bloco Parlamentar PODEMOS/PSDB/PSL/PSDB - CE)","Bloco Parlamentar PODEMOS/PSDB/PSL","PSDB","CE","","Bom, nós fizemos algumas pesquisas aqui, nós temos uma vasta documentação, que eu não vou apresentar, senão vou esgotar meu tempo, mas vou colocar nas mãos de todos os Srs. Senadores. De fato, pelo menos um acionista importante ou um executivo importante ou o dono do FIB Bank é o Sr. Marcos Tolentino, que o senhor disse que conhece. Tem algumas coincidências aqui incríveis, e existe até já um processo judicial de uma empresa em cima do FIB Bank correndo na Justiça em São Paulo que coloca realmente o Sr. Marcos Tolentino como o proprietário dessa empresa.         Existem várias coincidências. A Pico do Juazeiro, uma das donas da FIB Bank, tem o mesmo endereço social que a Sociedade Brasileira de Televisão, que pertence ao Sr. Marcos Tolentino. Qual é a sua relação ou tem alguma relação, algum tipo de relação com Marcos Tolentino? "
"526","46","2021-08-19","FRANCISCO EMERSON MAXIMIANO","","","","","","Eu o conheço, mas não tenho relação com ele, Sr. Senador. "
"527","46","2021-08-19","TASSO JEREISSATI","(Bloco Parlamentar PODEMOS/PSDB/PSL/PSDB - CE)","Bloco Parlamentar PODEMOS/PSDB/PSL","PSDB","CE","","O Marcos Tolentino tem uma relação... Tem vários pagamentos, troca de pagamentos entre Marcos Tolentino, Sr. Benetti, Sr. Danilo Trento. O senhor tem relação com o Danilo Trento? "
"528","46","2021-08-19","FRANCISCO EMERSON MAXIMIANO","","","","","","Sim, senhor. Ele é diretor institucional da Precisa Medicamentos. "
"529","46","2021-08-19","TASSO JEREISSATI","(Bloco Parlamentar PODEMOS/PSDB/PSL/PSDB - CE)","Bloco Parlamentar PODEMOS/PSDB/PSL","PSDB","CE","","Esses três – e aqui tenho toda a documentação; não vou apresentar, mas vai estar nas mãos de todos e, com certeza, a Senadora Simone, por exemplo, deve ter documentação com mais amostras –, esses três têm uma relação comercial profunda: Marcos Tolentino; Marcos Tolentino, por sua vez, tem relação comercial com Benetti; Benetti e Tolentino têm relação comercial com Trento; Trento tem relação comercial com V. Sa. É verdade isso? "
"530","46","2021-08-19","FRANCISCO EMERSON MAXIMIANO","","","","","","Com relação a essa pergunta do senhor, eu vou exercer o direito do silêncio, Sr. Senador. "
"531","46","2021-08-19","TASSO JEREISSATI","(Bloco Parlamentar PODEMOS/PSDB/PSL/PSDB - CE)","Bloco Parlamentar PODEMOS/PSDB/PSL","PSDB","CE","","Todo esse intrincado, Srs. Senadores – e eu digo que tenho alguma experiência nesse mundo de mercado, de empresas –, é uma das montagens mais intrincadas e vastas que eu vi na minha vida. Senador Omar, são dezenas de empresas – dezenas de empresas! –, e eu, para poupar a paciência de V. Exa., não quis aqui colocar em um vídeo o que liga esses quatro: Marcos Tolentino, Trento, Benetti e... Senador Omar, daria um complexo de malandragem e picaretagem sofisticadíssimo. Não sei o Senador Omar está me ouvindo... "
"532","46","2021-08-19","Omar Aziz","PRESIDENTE","(Omar Aziz. PSD - AM)","PSD","AM","","Senador Tasso, estou ouvindo V. Exa. Pode continuar, Senador Tasso. "
"533","46","2021-08-19","TASSO JEREISSATI","(Bloco Parlamentar PODEMOS/PSDB/PSL/PSDB - CE)","Bloco Parlamentar PODEMOS/PSDB/PSL","PSDB","CE","","Se puder me dar um tempinho a mais. "
"534","46","2021-08-19","Omar Aziz","PRESIDENTE","(Omar Aziz. PSD - AM)","PSD","AM","","O.k., Senador Tasso. Pode ficar à vontade. "
