"","reuniao","data","nome","funcao_blocoPar","BlocoParl","partido","estado","complemento","fala"
"684","46","2021-08-19","MARCOS ROGÉRIO","(Bloco Parlamentar Vanguarda/DEM - RO)","Bloco Parlamentar Vanguarda","DEM","RO","","Bom, se eu tiver a possibilidade de interpretar a negativa quanto a essa pergunta, que é elementar, ela pode sugerir muita coisa. Mas eu não vou lhe perguntar mais neste momento, porque, se essa pergunta, que é base, não pode ser respondida, certamente que não vai me acrescentar nada insistir nas demais. Talvez ao final. Sr. Presidente, eu quero registrar o que estamos vendo nesta CPI, com especial destaque ao dia de hoje. Em primeiro lugar, a mídia noticia o teor e as conclusões do relatório final que será apresentado pelo Senador Renan Calheiros. Vejam V. Exas.: esta CPI não teve sequer plano de trabalho. Normalmente ficamos sabendo das pautas da CPI pela imprensa, depois de reuniões secretas fora do Senado. E agora também, pela imprensa, ficamos sabendo quais são as conclusões que o Relator irá apontar em seu relatório – ele disse que é fake news, mas está lá a matéria. Desde o início alertei que o Relator já tinha um relatório debaixo do braço e que tudo se tratava de construir narrativas para sangrar o Presidente da República. Era jogo pré-eleitoral. Hoje a imprensa divulga justamente isso para todo o Brasil. O que me leva ao segundo ponto. No dia de hoje, a CPI quebrou o sigilo de diversos veículos digitais de informação, Senador Girão. Quebrou o sigilo, mas não é só isso: no dia de hoje, também, foram aprovados mais de 180 requerimentos, desde requerimentos de informação, de convocação, convite, a quebras de sigilo. Eu tenho uma série de requerimentos que nunca foram sequer pautados nesta CPI. O Senador Girão também. São 36 requerimentos de convocação de minha autoria, 6 requerimentos de convite, 6 requerimentos de informações, e 2 requerimentos de compartilhamento de informação. Dentre esses requerimentos, chama atenção a blindagem que fazem ao Estado da Bahia – o Estado da Bahia. Apresentei o Requerimento nº 698, de 2021, de convocação do Sr. Bruno Dauster, o qual deixou a Chefia da Casa Civil do Governo da Bahia após ter sido citado pela dona da Hempcare, Sra. Cristina Prestes, investigada pela Operação Ragnarok. A empresa vendeu, recebeu antecipado sem nota fiscal e não entregou 300 respiradores adquiridos pelo Consórcio Nordeste. Nunca pautaram esse requerimento – nunca. A oitiva do Sr. Bruno Dauster nunca foi cogitada por esta CPI, por quê?         Também nunca foi apreciado o Requerimento de informações nº 693, que pede informações ao Governo da Bahia sobre a realização de auditorias pela Secretaria da Saúde do Estado da Bahia em relação ao Município de Porto Seguro, lembrando que os requerimentos de informação sempre foram pautados e aprovados nesta CPI por acordo, só que essa regra não vale quando os requerimentos envolvem o Estado da Bahia. Blindagem, proteção absoluta ao Estado da Bahia. Além disso, jamais foi pautado o Requerimento de informações nº 694, requerendo documentos existentes entre a Secretaria da Saúde da Bahia com a Fundação Gonçalves e Sampaio, especialmente quanto aos contratos de gestão emergencial de hospitais. Olha aí. Olha o que aconteceu no Rio de Janeiro, gestão de hospitais, escândalo monumental que gerou a cassação de um Governador. Vai vendo, Brasil! Gestão no Estado do Pará, um esquema bilionário, mais de 1 bilhão envolvido nessa trama toda, vou mencionar. Mas estes aqui – hospitais nos Municípios de Camacan, Bahia, e Salvador – nunca foram pautados. Não pautaram o Requerimento nº 703, que pedia a convocação do Sr. Edmar Alves dos Santos – lembram-se dele? Escancarar o caso do Rio de Janeiro, o esquema das OS, daquela fundação, de tudo aquilo que aconteceu no Rio de Janeiro, mesmo sendo de conhecimento público a corrupção naquele Estado, tendo levado ao impeachment do Governador. Nunca pautaram. Também nunca foram pautados requerimentos em relação a casos de corrupção no Estado do Pará, onde foi deflagrada ontem, Senador Girão – ontem, ontem –, uma operação da Polícia Federal para apurar desvio bilionário, a bilionária Operação Reditus, segunda fase da Operação SOS, para combater o desvio de recursos públicos na área de saúde do Pará. Aqui, nesses contratos, mais de 1 bilhão suspeito de corrupção em contratos de organizações sociais para a gestão de hospitais públicos. Veja de novo: organizações sociais, gestão de hospitais públicos, Rio de Janeiro, Bahia, Pará... Mas aqui não passa! Aqui não passa. Vai vendo, Brasil! "
"685","46","2021-08-19","JEAN PAUL PRATES","(Bloco Parlamentar da Resistência Democrática/PT - RN)","Bloco Parlamentar da Resistência Democrática","PT","RN","","Calma, para não quebrar a bancada aí. "
"686","46","2021-08-19","MARCOS ROGÉRIO","(Bloco Parlamentar Vanguarda/DEM - RO)","Bloco Parlamentar Vanguarda","DEM","RO","","Vai vendo! Nesse caso... Já quebraram o Brasil no passado; parece que querem quebrar de novo a partir dos Estados. Nesse caso, não pautaram o Requerimento nº 1.056, de convocação do Sr. Parsifal de Jesus Pontes, ex-Secretário da Casa Civil do Pará e ex-Secretário de Desenvolvimento Econômico, Mineração e Energia do Pará, o qual estava entre os investigados na Operação SOS. O mesmo em relação ao Requerimento 1.057, sobre convocação do Sr. Peter Cassol Silveira – prestem atenção a esse nome –, ex-Secretário Adjunto de Gestão Administrativa da Secretaria de Saúde do Estado do Pará, o qual estava entre os investigados da Operação Para Bellum, sendo que, durante os mandados de busca e apreensão, foi encontrado sabe quanto na casa dele, sabe quanto, Girão? Quase R$1 milhão; R$750 mil em dinheiro vivo na casa do Sr. Peter Cassol.         Esta CPI, no dia 16 de junho de 2021, deliberou e rejeitou, por seis votos a cinco, os três requerimentos de convocação do Sr. Carlos Gabas, Secretário-Executivo do Consórcio Nordeste. Agora veja, Brasil, vai vendo! Por seis votos a cinco, também rejeitou a convocação do Sr. Carlos Gabas. Inclusive um requerimento era de minha autoria – o primeiro, do Senador Girão. Não quiseram convocar. Mas, diante de novas denúncias veiculadas na revista Veja, em 25 de julho de 2021, apresentei o Requerimento 1.239, requerendo novamente a convocação do Sr. Carlos Gabas. Segundo a revista Veja, durante o depoimento da Sra. Cristiana Prestes, a proprietária da Hempcare Pharma, foram levantadas suspeitas contra o Secretário-Executivo do Consórcio Nordeste, Carlos Eduardo Gabas, e em relação ao Prefeito de Araraquara, Edinho Silva. Cristiana afirmou aos investigadores que, na época dos eventos, recebeu um telefonema de Gabas, que teria se identificado como irmão de alma – irmão de alma – de Edinho, Prefeito de Araraquara. Gabas afirmou que o Município paulista estava precisando de 30 respiradores, mas que Edinho estava sem recursos para bancar a compra – estava implícito um pedido – e propôs a fazer uma doação. Senador Girão, nunca foi pautado o novo requerimento de convocação do Sr. Carlos Gabas. Por quê? Por quê? Por falar em Edinho Silva, apresentei o Requerimento 1.130, de 2021, para convocar o ex-Ministro de Dilma, atual Prefeito de Araraquara, mas nunca foi pautado. Por quê? Vai vendo, Brasil. Por fim, apresentei o Requerimento 1.251, pedindo ao Instituto Butantan informações sobre a composição dos valores das doses da vacina CoronaVac ofertadas ao Governo Federal diante da discrepância da oferta de doses de vacina pela Sinovac ao Consórcio Covax Facility, bem como o valor de US$10, contratado pela União junto ao Butantan e a última oferta de US$16, apresentada, inclusive juntada ao processo aqui, no âmbito desta CPI.         Veja, o Butantan vendeu vacina ao Ministério da Saúde a US$10; e o consórcio Covax Facility, a menos de US$6. (Soa a campainha.) "
"687","46","2021-08-19","MARCOS ROGÉRIO","(Bloco Parlamentar Vanguarda/DEM - RO)","Bloco Parlamentar Vanguarda","DEM","RO","","Como assim? (Interrupção do som.) "
"688","46","2021-08-19","Randolfe Rodrigues","PRESIDENTE","(Randolfe Rodrigues. PDT/CIDADANIA/REDE/REDE - AP)","REDE","AP","","Eu já acrescentei mais dois minutos a V. Exa. "
"689","46","2021-08-19","MARCOS ROGÉRIO","(Bloco Parlamentar Vanguarda/DEM - RO. Fora do microfone.)","Bloco Parlamentar Vanguarda","DEM","RO","Fora do microfone","Mais um minuto, eu concluo. "
"690","46","2021-08-19","Randolfe Rodrigues","PRESIDENTE","(Randolfe Rodrigues. PDT/CIDADANIA/REDE/REDE - AP)","REDE","AP","","Eu peço que... É um minuto mesmo. "
"691","46","2021-08-19","MARCOS ROGÉRIO","(Bloco Parlamentar Vanguarda/DEM - RO. Fora do microfone.)","Bloco Parlamentar Vanguarda","DEM","RO","Fora do microfone","Agradeço. "
"692","46","2021-08-19","JEAN PAUL PRATES","(Bloco Parlamentar da Resistência Democrática/PT - RN)","Bloco Parlamentar da Resistência Democrática","PT","RN","","Nós queremos interrogar a pessoa que está aqui... "
"693","46","2021-08-19","Randolfe Rodrigues","PRESIDENTE","(Randolfe Rodrigues. PDT/CIDADANIA/REDE/REDE - AP)","REDE","AP","","Sob embargo... "
"694","46","2021-08-19","JEAN PAUL PRATES","(Bloco Parlamentar da Resistência Democrática/PT - RN)","Bloco Parlamentar da Resistência Democrática","PT","RN","","... e não ouvir a história de novo pela décima vez. "
"695","46","2021-08-19","Randolfe Rodrigues","PRESIDENTE","(Randolfe Rodrigues. PDT/CIDADANIA/REDE/REDE - AP)","REDE","AP","","... Senador Marcos, se V. Exa. se estender mais, prejudicará os demais colegas. "
"696","46","2021-08-19","MARCOS ROGÉRIO","(Bloco Parlamentar Vanguarda/DEM - RO. Fora do microfone.)","Bloco Parlamentar Vanguarda","DEM","RO","Fora do microfone","Vou concluir, Sr. Presidente. "
"697","46","2021-08-19","Randolfe Rodrigues","PRESIDENTE","(Randolfe Rodrigues. PDT/CIDADANIA/REDE/REDE - AP)","REDE","AP","","Então, eu serei rigoroso nesse minuto que falta. "
"698","46","2021-08-19","MARCOS ROGÉRIO","(Bloco Parlamentar Vanguarda/DEM - RO)","Bloco Parlamentar Vanguarda","DEM","RO","","Sei que os anteriores tiveram mais benevolência, mas, em razão do horário da sessão, eu vou fechar em um minuto. "
"699","46","2021-08-19","Randolfe Rodrigues","PRESIDENTE","(Randolfe Rodrigues. PDT/CIDADANIA/REDE/REDE - AP)","REDE","AP","","Em respeito aos colegas, eu peço a V. Exa... "
"700","46","2021-08-19","MARCOS ROGÉRIO","(Bloco Parlamentar Vanguarda/DEM - RO)","Bloco Parlamentar Vanguarda","DEM","RO","","Agradeço a V. Exa. "
"701","46","2021-08-19","JEAN PAUL PRATES","(Bloco Parlamentar da Resistência Democrática/PT - RN)","Bloco Parlamentar da Resistência Democrática","PT","RN","","A questão é o tema, não é o tempo. "
"702","46","2021-08-19","ELIZIANE GAMA","(PDT/CIDADANIA/REDE/CIDADANIA - MA)","(PDT/CIDADANIA/REDE/CIDADANIA - MA)","CIDADANIA","MA","","Faltam dois minutos, Presidente, para o início da sessão. "
"703","46","2021-08-19","Randolfe Rodrigues","PRESIDENTE","(Randolfe Rodrigues. PDT/CIDADANIA/REDE/REDE - AP)","REDE","AP","","Perfeito. Esse é terceiro minuto que eu incluo. "
"704","46","2021-08-19","MARCOS ROGÉRIO","(Bloco Parlamentar Vanguarda/DEM - RO)","Bloco Parlamentar Vanguarda","DEM","RO","","Veja, Sr. Presidente, veja: o Butantan vendeu vacina ao Ministério da Saúde na casa dos US$10; e o consórcio Covax, com um preço muito menor. Mas como assim? Por que quase o dobro para o Ministério da Saúde? Mas nem esse requerimento nós conseguimos aprovar aqui – nem esse. Esta é a CPI de uma investigação parcial, um jogo eleitoral, pré-eleitoral; que blinda o que aconteceu nos Estados e Municípios. Eu sou a favor de investigar tudo, o que aconteceu no Ministério da Saúde, mas também nos Estados e nos Municípios. Tomara que a gente tenha, nos próximos dias, mais sorte e consigamos aprovar esses requerimentos, Senador Girão... (Soa a campainha.) "
"705","46","2021-08-19","MARCOS ROGÉRIO","(Bloco Parlamentar Vanguarda/DEM - RO)","Bloco Parlamentar Vanguarda","DEM","RO","","... porque até aqui não tivemos sorte. Muito obrigado, Sr. Presidente. "
"706","46","2021-08-19","Randolfe Rodrigues","PRESIDENTE","(Randolfe Rodrigues. PDT/CIDADANIA/REDE/REDE - AP)","REDE","AP","","Obrigado, Senador Marcos Rogério. Na sequência, em permuta com o Senador Eduardo Braga, o Senador Izalci Lucas. "
"707","46","2021-08-19","IZALCI LUCAS","(Bloco Parlamentar PODEMOS/PSDB/PSL/PSDB - DF. Para interpelar.)","Bloco Parlamentar PODEMOS/PSDB/PSL","PSDB","DF","Para interpelar","Obrigado, Presidente. Presidente, eu pergunto já ao Sr. Francisco: V. Sa. conhece o Sr. Adeilson Loureiro Cavalcante? "
"708","46","2021-08-19","FRANCISCO EMERSON MAXIMIANO","(Para depor.)","(Para depor.)","(Para depor.)","(Para depor.)","(Para depor","Não me recordo. "
"709","46","2021-08-19","IZALCI LUCAS","(Bloco Parlamentar PODEMOS/PSDB/PSL/PSDB - DF)","Bloco Parlamentar PODEMOS/PSDB/PSL","PSDB","DF","","Não se recorda? "
"710","46","2021-08-19","FRANCISCO EMERSON MAXIMIANO","","","","","","Não me recordo. O senhor pode dar algum outro detalhe dele? "
"711","46","2021-08-19","IZALCI LUCAS","(Bloco Parlamentar PODEMOS/PSDB/PSL/PSDB - DF)","Bloco Parlamentar PODEMOS/PSDB/PSL","PSDB","DF","","Ele foi o Secretário-Executivo do Ministério da Saúde na gestão Ricardo Barros, na gestão Occhi... Era secretário também da saúde na época do ministério... Não conhece? "
"712","46","2021-08-19","FRANCISCO EMERSON MAXIMIANO","","","","","","Não sei, não me recordo. "
"713","46","2021-08-19","IZALCI LUCAS","(Bloco Parlamentar PODEMOS/PSDB/PSL/PSDB - DF)","Bloco Parlamentar PODEMOS/PSDB/PSL","PSDB","DF","","V. Sa. conhece o ex-Secretário de Saúde, o Sr. Francisco Araújo Filho? "
"714","46","2021-08-19","FRANCISCO EMERSON MAXIMIANO","","","","","","Sim. "
"715","46","2021-08-19","IZALCI LUCAS","(Bloco Parlamentar PODEMOS/PSDB/PSL/PSDB - DF)","Bloco Parlamentar PODEMOS/PSDB/PSL","PSDB","DF","","Quantas vezes o senhor esteve reunido com ele mais ou menos? "
"716","46","2021-08-19","FRANCISCO EMERSON MAXIMIANO","","","","","","Não me recordo muito, mas muito poucas... "
"717","46","2021-08-19","IZALCI LUCAS","(Bloco Parlamentar PODEMOS/PSDB/PSL/PSDB - DF)","Bloco Parlamentar PODEMOS/PSDB/PSL","PSDB","DF","","Mas... Muitas vezes, poucas vezes? "
"718","46","2021-08-19","FRANCISCO EMERSON MAXIMIANO","","","","","","Não, poucas vezes, exclusivamente na secretaria. "
"719","46","2021-08-19","IZALCI LUCAS","(Bloco Parlamentar PODEMOS/PSDB/PSL/PSDB - DF)","Bloco Parlamentar PODEMOS/PSDB/PSL","PSDB","DF","","E tratando de que assunto? Pode falar? "
"720","46","2021-08-19","FRANCISCO EMERSON MAXIMIANO","","","","","","Por ocasião do fornecimento dos testes rápidos para o GDF. "
"721","46","2021-08-19","IZALCI LUCAS","(Bloco Parlamentar PODEMOS/PSDB/PSL/PSDB - DF)","Bloco Parlamentar PODEMOS/PSDB/PSL","PSDB","DF","","Quem colocou a Precisa Medicamentos em contato com o Francisco Araújo Filho. "
"722","46","2021-08-19","FRANCISCO EMERSON MAXIMIANO","","","","","","Sr. Senador, eu vou exercer o silêncio. "
"723","46","2021-08-19","IZALCI LUCAS","(Bloco Parlamentar PODEMOS/PSDB/PSL/PSDB - DF)","Bloco Parlamentar PODEMOS/PSDB/PSL","PSDB","DF","","Como? Quem? "
"724","46","2021-08-19","FRANCISCO EMERSON MAXIMIANO","","","","","","Eu vou exercer o silêncio, Sr. Senador. "
"725","46","2021-08-19","IZALCI LUCAS","(Bloco Parlamentar PODEMOS/PSDB/PSL/PSDB - DF)","Bloco Parlamentar PODEMOS/PSDB/PSL","PSDB","DF","","Por que eu estou perguntando isso? O Sr. Francisco Araújo... Primeiro, como V. Sa. já disse, dos testes rápidos aqui no Distrito Federal. A empresa Precisa entrou realmente nessa questão da corrupção do GDF. E vou dizer como – inclusive, através do próprio Francisco. Eu estou perguntando por que o Francisco teve a iniciativa de colocar a proposta da Precisa, primeiro, fora do prazo. Ele cancelou duas outras, alegando que as outras não entregaram em 24 horas, porque o edital era 24 horas, mas aceitou e colocou, inclusive tem telefonemas aqui com toda a equipe da saúde. Ele fez de uma forma para tornar a Precisa vencedora, inclusive com o preço de R$139 contra o primeiro lugar, que foi R$74. Então, foi colocado fora do prazo, com a participação de toda a cúpula da saúde, aquela que foi presa na Operação Falso Negativo.         Então, por isso que nos interessa saber: por que o Francisco fez todo esse esforço? Bem, V. Sa. diz que esteve com ele. O que eu posso deduzir agora é que quem fez as tratativas com ele foi V. Sa. V. Sa confirma que essa negociação foi feita direto com ele, com o Francisco? "
"726","46","2021-08-19","FRANCISCO EMERSON MAXIMIANO","(Para depor.)","(Para depor.)","(Para depor.)","(Para depor.)","(Para depor","Vou exercer o direito do silêncio, Sr. Senador. "
"727","46","2021-08-19","IZALCI LUCAS","(Bloco Parlamentar PODEMOS/PSDB/PSL/PSDB - DF)","Bloco Parlamentar PODEMOS/PSDB/PSL","PSDB","DF","","V. Sa. conhece o Sr. João Kennedy Braga? "
"728","46","2021-08-19","FRANCISCO EMERSON MAXIMIANO","","","","","","Não, senhor. "
"729","46","2021-08-19","IZALCI LUCAS","(Bloco Parlamentar PODEMOS/PSDB/PSL/PSDB - DF)","Bloco Parlamentar PODEMOS/PSDB/PSL","PSDB","DF","","Nessas tratativas com o Francisco, não houve nenhuma sinalização de conversar com o Sr. Kennedy? Sr. Kennedy era o operador dele. Francisco conversava com os fornecedores, mas quem era o operador era o Sr. João Kennedy Braga. Com relação ao Governador, V. Sa. conhece o Governador Ibaneis Rocha? "
"730","46","2021-08-19","FRANCISCO EMERSON MAXIMIANO","","","","","","Conheço como candidato a Governador. "
"731","46","2021-08-19","IZALCI LUCAS","(Bloco Parlamentar PODEMOS/PSDB/PSL/PSDB - DF)","Bloco Parlamentar PODEMOS/PSDB/PSL","PSDB","DF","","Já esteve com ele em algum momento? "
"732","46","2021-08-19","FRANCISCO EMERSON MAXIMIANO","","","","","","Não, senhor. "
"733","46","2021-08-19","IZALCI LUCAS","(Bloco Parlamentar PODEMOS/PSDB/PSL/PSDB - DF)","Bloco Parlamentar PODEMOS/PSDB/PSL","PSDB","DF","","Secretário Osnei, conhece também? "
"734","46","2021-08-19","FRANCISCO EMERSON MAXIMIANO","","","","","","Desculpe, quem? "
"735","46","2021-08-19","IZALCI LUCAS","(Bloco Parlamentar PODEMOS/PSDB/PSL/PSDB - DF)","Bloco Parlamentar PODEMOS/PSDB/PSL","PSDB","DF","","O Secretário atual, Osnei Okumoto, que era do Ministério da Saúde e que hoje é o Secretário de Saúde. "
"736","46","2021-08-19","FRANCISCO EMERSON MAXIMIANO","","","","","","Não o conheço. Não, senhor. "
"737","46","2021-08-19","IZALCI LUCAS","(Bloco Parlamentar PODEMOS/PSDB/PSL/PSDB - DF)","Bloco Parlamentar PODEMOS/PSDB/PSL","PSDB","DF","","Nunca esteve com ele? Não o conhece? "
"738","46","2021-08-19","FRANCISCO EMERSON MAXIMIANO","","","","","","Não, senhor. "
"739","46","2021-08-19","IZALCI LUCAS","(Bloco Parlamentar PODEMOS/PSDB/PSL/PSDB - DF)","Bloco Parlamentar PODEMOS/PSDB/PSL","PSDB","DF","","Bem, eu sei que inclusive a Justiça determinou o não pagamento. Eu sei que inclusive alguns V. Sa., a Precisa, tem inclusive créditos para receber no GDF, mas foi impedida exatamente por decisão tanto do Tribunal de Contas da União, que tem aqui o acórdão, proibindo de pagar uma série de fornecedores... Mas o que eu fico muito preocupado, Sr. Francisco, é o seguinte. Primeiro, nessa mesma ocasião, a Precisa vendeu 150 mil unidades a 139,90, quando o outro participante, que ficou em primeiro lugar, tinha um preço de 73. Que ainda era muito alto, porque, coincidentemente, na mesma semana, o Sesc fez um pregão eletrônico SRP nº 38 de 2020. O Sesc conseguiu comprar esse mesmo teste que estava no edital por R$18. E, por incrível que pareça, o GDF ainda comprou da Luna Park, que é uma empresa de brinquedos, a R$180, quer dizer, dez vezes mais do que aquilo que foi comprado pelo Sesc através de um pregão eletrônico. Mas o maior problema não foi apenas isso. Isso aí foi um problema grande, de corrupção, de beneficiamento, porque na prática a empresa de V. Sa. não ficou em primeiro lugar, mas o mais grave disso é que a empresa de V. Sa. entregou um outro produto e, segundo informações que nós temos na CPI, a troca do produto foi fora do prazo, a autorização oficial foi depois que foi entregue o teste e, por incrível que pareça, o teste que foi entregue não era exatamente o teste que estava no edital. O teste que foi entregue é o Livzon, que estava sendo recolhido no mundo todo – na Índia, na Dinamarca, na Argentina – por quê? Porque não tinha nenhuma eficácia, por isso a operação chamada Falso Negativo. V. Sa. tem ideia, mais ou menos, de quantas pessoas poderiam, ou morreram, em função do teste falso negativo? Ou seja, as pessoas fizeram o teste, foram para casa como se estivesse negativo o teste e, na prática, esse teste não tinha valor nenhum. Então, muitas pessoas foram para casa com o teste negativo e, possivelmente, muitos estavam positivos e que não, por questão de tempo, procuraram o médico ou hospital no tempo e na hora. Então, isso, com certeza, pode ter provocado muitas mortes aqui no Distrito Federal.         Agora, eu pergunto, com relação a essa questão do teste. Esse teste que foi entregue, esse Livzon, que é uma produção chinesa e que estava sendo recolhida já no mundo todo, como é que foi a compra desse teste para atender o GDF? Foi... Comprou de onde? Importou de onde? Porque os países estavam recolhendo. V. Sa. poderia dizer de onde que a Precisa comprou este produto para entregar ao GDF? "
"740","46","2021-08-19","FRANCISCO EMERSON MAXIMIANO","","","","","","Eu vou exercer o direito do silêncio, Sr. Senador. "
"741","46","2021-08-19","IZALCI LUCAS","(Bloco Parlamentar PODEMOS/PSDB/PSL/PSDB - DF)","Bloco Parlamentar PODEMOS/PSDB/PSL","PSDB","DF","","V. Sa., quando esteve com o Secretário Francisco Araújo, V. Sa. ofereceu algo para ele? Alguma... Algum benefício? Ou algum favor? Alguma coisa assim? "
"742","46","2021-08-19","FRANCISCO EMERSON MAXIMIANO","","","","","","Sr. Senador, respeitosamente, eu vou exercer o direito ao silêncio. "
