"","reuniao","data","nome","funcao_blocoPar","BlocoParl","partido","estado","complemento","fala"
"1271","5","2021-05-06","Omar Aziz","PRESIDENTE","(Omar Aziz. PSD - AM)","PSD","AM","","Obrigado. "
"1272","5","2021-05-06","ANGELO CORONEL","(PSD - BA)","(PSD - BA)","PSD","BA","","Inclusive utilizando artistas, o que é muito importante. "
"1273","5","2021-05-06","Omar Aziz","PRESIDENTE","(Omar Aziz. PSD - AM)","PSD","AM","","Senador Izalci Lucas!  Senador Izalci Lucas. Depois, Senador Jean Paul Prates... "
"1274","5","2021-05-06","JEAN PAUL PRATES","(Bloco Parlamentar da Resistência Democrática/PT - RN)","Bloco Parlamentar da Resistência Democrática","PT","RN","","Presidente, Presidente... "
"1275","5","2021-05-06","Omar Aziz","PRESIDENTE","(Omar Aziz. PSD - AM)","PSD","AM","","... Senadora Soraya, Senadora Eliziane, Senador Fabiano Contarato e Senadora Zenaide. Aí acabou. "
"1276","5","2021-05-06","JEAN PAUL PRATES","(Bloco Parlamentar da Resistência Democrática/PT - RN)","Bloco Parlamentar da Resistência Democrática","PT","RN","","Está triste, Presidente? "
"1277","5","2021-05-06","Omar Aziz","PRESIDENTE","(Omar Aziz. PSD - AM)","PSD","AM","","O papel nosso é trabalhar. O que é que a gente vai fazer? Senador Izalci! "
"1278","5","2021-05-06","SORAYA THRONICKE","(Bloco Parlamentar PODEMOS/PSDB/PSL/PSL - MS)","Bloco Parlamentar PODEMOS/PSDB/PSL","PSL","MS","","Será que o Ministro não quer, Presidente, comer? Um intervalo? "
"1279","5","2021-05-06","RANDOLFE RODRIGUES","(Bloco Parlamentar Senado Independente/REDE - AP)","Bloco Parlamentar Senado Independente","REDE","AP","","Já teve. "
"1280","5","2021-05-06","SORAYA THRONICKE","(Bloco Parlamentar PODEMOS/PSDB/PSL/PSL - MS)","Bloco Parlamentar PODEMOS/PSDB/PSL","PSL","MS","","Ele é gente, como... "
"1281","5","2021-05-06","MARCELO ANTÔNIO CARTAXO QUEIROGA LOPES","","","","","","Ministro não come, não, Senadora. "
"1282","5","2021-05-06","SORAYA THRONICKE","(Bloco Parlamentar PODEMOS/PSDB/PSL/PSL - MS)","Bloco Parlamentar PODEMOS/PSDB/PSL","PSL","MS","","Já fez, mas um segundo intervalo, gente, visto o adiantado da hora. "
"1283","5","2021-05-06","Omar Aziz","PRESIDENTE","(Omar Aziz. PSD - AM)","PSD","AM","","Depois do Senador Izalci, vamos tomar uma água. "
"1284","5","2021-05-06","IZALCI LUCAS","(Bloco Parlamentar PODEMOS/PSDB/PSL/PSDB - DF)","Bloco Parlamentar PODEMOS/PSDB/PSL","PSDB","DF","","Presidente... "
"1285","5","2021-05-06","Omar Aziz","PRESIDENTE","(Omar Aziz. PSD - AM)","PSD","AM","","Senador Izalci! "
"1286","5","2021-05-06","IZALCI LUCAS","(Bloco Parlamentar PODEMOS/PSDB/PSL/PSDB - DF. Pela ordem. Por videoconferência.)","Bloco Parlamentar PODEMOS/PSDB/PSL","PSDB","DF","Pela ordem Por videoconferência","Presidente, eu quero começar a minha fala fazendo uma questão de ordem. Nós já estamos, Presidente, recebendo os documentos dos requerimentos de informação. Então, eu gostaria de perguntar a V. Exa. se V. Exa. vai fazer a normativa de acesso aos documentos, principalmente os documentos sigilosos que estão chegando já para análise. Então, essa é a primeira fala. Com relação... V. Exa. quer responder ou já entro nas perguntas, Presidente? "
"1287","5","2021-05-06","Omar Aziz","PRESIDENTE","(Omar Aziz. PSD - AM)","PSD","AM","","Senador Izalci, nós estamos definindo onde nós vamos colocar esses documentos. Tem alguns documentos que são sigilosos, e nós temos que ter um critério para poder acessar. Assim que nós tivermos... Eu acho que, na terça-feira, nós já teremos uma posição, porque é necessário ter um cofre para guardar esses documentos. Tem a responsabilidade de que não se vazem dados de ninguém. Mas essa é uma preocupação... E a imprensa toda está perguntando também: ""Quem é que vai tomar conta disso?"" Quem vai tomar conta disso é o Senado. O Senado tem a responsabilidade de que não se vaze nenhuma informação. Algumas são públicas a que todo mundo pode ter acesso; outras são sigilosas, e a gente tem que ter todos os cuidados necessários para que a gente não cometa nenhum crime, deixando vazar essas informações. Então, no momento certo, Senador, nós vamos tratar sobre esses assuntos. "
"1288","5","2021-05-06","IZALCI LUCAS","(Bloco Parlamentar PODEMOS/PSDB/PSL/PSDB - DF)","Bloco Parlamentar PODEMOS/PSDB/PSL","PSDB","DF","","É só porque já chegaram, inclusive, inquéritos. Mas tudo bem. "
"1289","5","2021-05-06","Omar Aziz","PRESIDENTE","(Omar Aziz. PSD - AM)","PSD","AM","","Só chegou um inquérito até agora.         "
"1290","5","2021-05-06","IZALCI LUCAS","(Bloco Parlamentar PODEMOS/PSDB/PSL/PSDB - DF)","Bloco Parlamentar PODEMOS/PSDB/PSL","PSDB","DF","","Exatamente. Eu sei. Bem, eu vou entrar, então, Presidente, na minha fala com o Ministro. Ministro, primeiro, agradeço a forma como V. Exa. tem colaborado com a CPI. Eu quero, inicialmente, Ministro... "
"1291","5","2021-05-06","Omar Aziz","PRESIDENTE","(Omar Aziz. PSD - AM)","PSD","AM","","Senador Izalci, só um minutinho.  "
"1292","5","2021-05-06","IZALCI LUCAS","(Bloco Parlamentar PODEMOS/PSDB/PSL/PSDB - DF)","Bloco Parlamentar PODEMOS/PSDB/PSL","PSDB","DF","","Pois não. "
"1293","5","2021-05-06","Omar Aziz","PRESIDENTE","(Omar Aziz. PSD - AM)","PSD","AM","","Eu vou suspender a reunião. O Presidente do Senado está pedindo para encerrar a reunião porque ele vai colocar em votação as matérias. São duas matérias para serem votadas. Terminando a votação, a gente retoma aqui, para concluir com os Senadores que estão faltando. Eu não posso fazer nada, Senadora Soraya. "
"1294","5","2021-05-06","SORAYA THRONICKE","(Bloco Parlamentar PODEMOS/PSDB/PSL/PSL - MS. Pela ordem.)","Bloco Parlamentar PODEMOS/PSDB/PSL","PSL","MS","Pela ordem","Não, eu só queria saber se a gente vai ter condições de fazer pergunta hoje. "
"1295","5","2021-05-06","Omar Aziz","PRESIDENTE","(Omar Aziz. PSD - AM)","PSD","AM","","Vai. Vai. "
"1296","5","2021-05-06","SORAYA THRONICKE","(Bloco Parlamentar PODEMOS/PSDB/PSL/PSL - MS)","Bloco Parlamentar PODEMOS/PSDB/PSL","PSL","MS","","Se a gente vai conseguir falar, porque nós abrimos mão, e muita gente extrapolou o prazo. "
"1297","5","2021-05-06","Omar Aziz","PRESIDENTE","(Omar Aziz. PSD - AM)","PSD","AM","","Senadora... "
"1298","5","2021-05-06","SORAYA THRONICKE","(Bloco Parlamentar PODEMOS/PSDB/PSL/PSL - MS)","Bloco Parlamentar PODEMOS/PSDB/PSL","PSL","MS","","Estou tranquila, Senador. Se o senhor falou, não me preocupo, é só uma pergunta. "
"1299","5","2021-05-06","Omar Aziz","PRESIDENTE","(Omar Aziz. PSD - AM)","PSD","AM","","Quando o Relator e o Doutor Queiroga, que agora vai descansar, porque ele vai lá para o meu gabinete. Não há problema nenhum. "
"1300","5","2021-05-06","SORAYA THRONICKE","(Bloco Parlamentar PODEMOS/PSDB/PSL/PSL - MS)","Bloco Parlamentar PODEMOS/PSDB/PSL","PSL","MS","","Pelo que nós lemos aqui, parece que é muito clara a letra do Regimento Interno, dizendo que não pode coincidir com a Ordem do Dia. Aí a minha preocupação. "
"1301","5","2021-05-06","Omar Aziz","PRESIDENTE","(Omar Aziz. PSD - AM)","PSD","AM","","Não, tudo bem. Vamos suspender a reunião? "
"1302","5","2021-05-06","RANDOLFE RODRIGUES","(Bloco Parlamentar Senado Independente/REDE - AP)","Bloco Parlamentar Senado Independente","REDE","AP","","Presidente, só uma pergunta... "
"1303","5","2021-05-06","SORAYA THRONICKE","(Bloco Parlamentar PODEMOS/PSDB/PSL/PSL - MS. Pela ordem.)","Bloco Parlamentar PODEMOS/PSDB/PSL","PSL","MS","Pela ordem","Eu quero falar, né? Aí nós abrimos mão do tempo, enfim. "
"1304","5","2021-05-06","Omar Aziz","PRESIDENTE","(Omar Aziz. PSD - AM)","PSD","AM","","Eu vou seguir a orientação do Presidente do Congresso Nacional, Senador Rodrigo Pacheco. "
"1305","5","2021-05-06","RANDOLFE RODRIGUES","(Bloco Parlamentar Senado Independente/REDE - AP. Para interpelar.)","Bloco Parlamentar Senado Independente","REDE","AP","Para interpelar","Só uma pergunta técnica ao Ministro, Presidente. Ministro, ao paciente com Covid recomenda-se receber visitas? "
"1306","5","2021-05-06","MARCELO ANTÔNIO CARTAXO QUEIROGA LOPES","(Para depor.)","(Para depor.)","(Para depor.)","(Para depor.)","(Para depor","Desde que exista o controle adequado. "
"1307","5","2021-05-06","RANDOLFE RODRIGUES","(Bloco Parlamentar Senado Independente/REDE - AP)","Bloco Parlamentar Senado Independente","REDE","AP","","Não, visita externa, qualquer tipo de visita. "
"1308","5","2021-05-06","MARCELO ANTÔNIO CARTAXO QUEIROGA LOPES","","","","","","Não, há que haver um regramento de acordo com cada instituição. "
"1309","5","2021-05-06","RANDOLFE RODRIGUES","(Bloco Parlamentar Senado Independente/REDE - AP)","Bloco Parlamentar Senado Independente","REDE","AP","","Mas a recomendação é o isolamento? "
"1310","5","2021-05-06","MARCELO ANTÔNIO CARTAXO QUEIROGA LOPES","","","","","","Há hospitais que disponibilizam uma televisita. "
"1311","5","2021-05-06","RANDOLFE RODRIGUES","(Bloco Parlamentar Senado Independente/REDE - AP)","Bloco Parlamentar Senado Independente","REDE","AP","","Não, é porque o Ministro Onyx, eu acho que resolveu correr o risco de visitar o Sr. Eduardo Pazuello no dia de hoje. Estranho porque ele informou a esta CPI que ele estava infectado com a Covid-19. Então, me parece que é uma infração sanitária por parte de S. Exa. "
"1312","5","2021-05-06","FABIANO CONTARATO","(Bloco Parlamentar Senado Independente/REDE - ES. Pela ordem.)","Bloco Parlamentar Senado Independente","REDE","ES","Pela ordem","Colega Randolfe, em processo penal, isso é condução coercitiva, Presidente. "
"1313","5","2021-05-06","Omar Aziz","PRESIDENTE","(Omar Aziz. PSD - AM)","PSD","AM","","Senador Izalci, nós vamos voltar assim que terminar a sessão do Senado. Voltaremos, e o senhor será o primeiro a falar, Senador Izalci. Obrigado. (Suspensa às 16 horas e 54 minutos, a reunião é reaberta às 18 horas e 36 minutos.)         "
"1314","5","2021-05-06","Omar Aziz","PRESIDENTE","(Omar Aziz. PSD - AM)","PSD","AM","","O Senador Izalci estava com a palavra. Depois, a Senadora... Senador Izalci, por favor. "
"1315","5","2021-05-06","IZALCI LUCAS","(Bloco Parlamentar PODEMOS/PSDB/PSL/PSDB - DF. Por videoconferência.)","Bloco Parlamentar PODEMOS/PSDB/PSL","PSDB","DF","Por videoconferência","Pois não, Presidente. Presidente, primeiro, eu quero trabalhar mais na linha... Ministro, com relação, lógico, às apurações, nós apresentamos diversos requerimentos, convocações que ainda não foram deliberadas, e nós estamos aguardando toda a documentação, mas eu tive a oportunidade de falar com o Ministro Mandetta e gostaria de perguntar a V. Exa. sobre isso. O grande problema que eu vejo na saúde, já há algum tempo, é exatamente a falta de informatização do Sistema Único de Saúde. E, consequentemente, também, em todas as Secretarias Municipais, há falta da informatização, há falta de informação, de controle, há falta de gestão mesmo do sistema de saúde. Eu não tenho nenhuma dúvida que grande parte do desvio de recurso, da corrupção na questão da saúde é falta realmente de entrar a questão da informatização, o que vários países já estão fazendo, e o Brasil está muito atrasado com relação a isso. Aqui, para V. Exa. ter uma ideia, aqui no Distrito Federal, sequer tem controle de estoque de medicamentos. E acredito que seja realidade em outros lugares, mas na Capital do País acontece isso. Não tem nenhuma interação, nenhuma integração entre hospitais, unidades de saúde, postos de saúde, nada. Se você pegar dez receitas aqui, do mesmo medicamento, você vai em dez lugares diferentes e pega o mesmo medicamento. Para o senhor ter ideia, basta ver a corrupção que está aqui; a cúpula da saúde foi presa, e os argumentos do advogado de defesa tirou da prisão, alegando que era recurso federal. Portanto, nós vamos verificar isso aqui. Mas, não só há a questão de controle, há a questão da dignidade. O cidadão hoje, Sr. Ministro, sai de casa às 6h da manhã, pega um ônibus, duas, três horas para chegar a um hospital e marcar uma consulta. E aí, muitas vezes, nem marca a consulta, uma coisa que você pode fazer em alguns segundos, utilizando os aplicativos. Então falta, realmente, as pessoas... Eu fico, assim, indignado, como as pessoas vão para o hospital público: parece que estão pedindo um favor. Há uma falta realmente de dignidade da pessoa humana. E há vários países, como eu disse – a Estônia, por exemplo; nós vamos fazer uma audiência pública agora, nos próximos dias, com a Presidente da Estônia –, 100% digitais.         E, na prática, o próprio Ministro Mandetta disse que havia alguma dificuldade. Ele tentou. Foi feita, inclusive uma proposta inicial, lá em Alagoas. Mas eu vejo assim: o sistema é único, é universal. Cabe ao Ministério da Saúde incentivar ou determinar ou condicionar esse controle, essa informatização para que haja realmente o controle, o planejamento. Não se planeja nada. Você não tem informação correta. Então, a minha sugestão... Eu sei que nós estamos em pandemia, mas eu garanto que nós vamos economizar, no mínimo, 30% dos recursos se tivermos controle, se tivermos informática, se tivermos realmente a determinação de termos uma gestão eficiente. Outra coisa, Ministro, que acontece muito no Brasil, lamentavelmente, e eu fui um dos pioneiros disso aqui no DF, na questão da educação. Nós não podemos continuar financiando Fies, ProUni. E eu tive o privilégio de começar em Brasília, em 1998, um projeto chamado Cheque Educação e, depois, veio o ProUni. Nós temos que compatibilizar as necessidades do País com as bolsas ou com o financiamento. Se falta médico, temos que financiar mais médicos. Se faltam clínicos, se faltam físicos, se faltam enfermeiros, se faltam auxiliares de enfermagem, nós temos que patrocinar, com recursos do Fies e do ProUni, exatamente aqueles profissionais que estão faltando no Brasil. Isso é política pública. Agora, é iniciativa do Executivo. Então, levando em consideração que há essa discussão, inclusive, nos cursos de Medicina, indo para a saúde...  Há realmente divergência com relação a isso. Não sei o que V. Exa. pensa sobre isso, mas estavam tirando da educação a questão da formação e jogando tudo na saúde. Eu queria sugerir que, além da questão de informatizar o mais rápido possível o sistema, também se fizesse essa questão da prioridade com relação ao Fies e ao ProUni, exatamente para esses profissionais que faltam no mercado, que o Governo precisa e não há condição... Eu tenho, inclusive, uma PEC, a PEC 200, desde 2011, que permite ao Governo Federal solicitar, se precisar, em qualquer área, principalmente Medicina – outras atividades, mas principalmente Medicina –, para que os alunos que se formam nas universidades públicas possam prestar serviço onde há necessidade. Ou o aluno... Lógico, recebendo salário normal, mas é inadmissível você não ter médico em vários Municípios do Brasil e nas capitais você ter excessos de médicos, muitos deles formados nas universidades públicas e que acabam não dando a contrapartida para a sociedade. Então, eu acho que a gente não pode deixar de atender vários Municípios por falta de médico, por falta de enfermeiro ou de profissionais da saúde. Então, eu, já dentro dessa perspectiva, acho que a CPI tem o papel não só de apurar as irregularidades, mas também de contribuir com a melhoria da legislação, com a melhoria da gestão pública. Então, com relação a essa contribuição, eu queria ver se V. Exa. poderia se comprometer nesse sentido. Eu sei que há resistência. Nunca se gastou tanto com informática nesses Estados, mas nunca funcionou, porque não há interesse em que se tenha controle.         O escândalo, a corrupção no sistema de saúde no Brasil é gritante, decepcionante. Há uma indignação quando a gente vê desvio de recurso público na área de saúde – as pessoas morrendo e não tem. E outra coisa, Ministro: a questão nós aprovamos na Comissão do Covid, Paulo Guedes falou pela primeira vez, disponibilizando R$20 bilhões para a compra de vacina. Eu espero que aconteça isto agora no Orçamento: nós tínhamos R$200 milhões no Orçamento para os testes 1 e 2 da vacina nacional, da Universidade de Minas e da Universidade de São Paulo, e para fazer o teste 3. Serão necessários para essas três vacinas R$710 milhões. É nada, é quase nada, se você avaliar o benefício que é você dominar – e o Brasil tem todas as condições para isso – a questão da vacina nacional. Nós temos, talvez, os melhores profissionais de pesquisa na área do vírus e temos uma rede, inclusive, magnífica, mas como sempre falta recurso. Então, eu sei que tem muito a ver com o Ministério da Ciência e Tecnologia, mas eu acho que o Brasil é único, o Governo é um só. Tem que compatibilizar essa conversa com o Ministério da Ciência e Tecnologia e com o Ministério da Saúde para que a gente realmente ter a nossa vacina, porque V. Exa., que é médico, sabe que todo dia tem uma variante diferente. Se a gente tiver que comprar vacina para cada variante, não vamos a lugar nenhum. Então, a prioridade tem que ser a autonomia na produção da vacina nacional. Então, eram essas minhas considerações. Eu queria perguntar a V. Exa. se V. Exa. está providenciando essa questão da informatização do Sistema Único de Saúde. "
"1316","5","2021-05-06","MARCELO ANTÔNIO CARTAXO QUEIROGA LOPES","(Para depor.)","(Para depor.)","(Para depor.)","(Para depor.)","(Para depor","Senador, obrigado pelas considerações do senhor, são considerações pertinentes. Nós vamos tomar providências para avançar com o aprimoramento do processo de informatização do Ministério da Saúde. Acerca da formação dos profissionais de saúde, isso é prioridade absoluta. Nós estamos atentos a esse ponto. Já, em parceria com o Ministério da Educação, vamos ofertar bolsas para medicina intensiva. Sobre a questão da pesquisa da vacina, obviamente há que serem feitas pesquisas com a vacina nacional. Há essas dificuldades orçamentárias, mas é possível superar essas questões para não paralisar as pesquisas com a vacina a que o senhor fez alusão. "
"1317","5","2021-05-06","IZALCI LUCAS","(Bloco Parlamentar PODEMOS/PSDB/PSL/PSDB - DF)","Bloco Parlamentar PODEMOS/PSDB/PSL","PSDB","DF","","Presidente, só para complementar, eu tive agora uma reunião com o Ministro da Ciência e Tecnologia. Nós temos no Brasil 16 institutos de pesquisa. E é bom já começarmos a levantar esta questão: nós estamos trabalhando com a metade do contingente necessário para os institutos de pesquisa, que são os melhores do mundo, e, na prática, a metade desses que restam tem já condições de aposentar, já está numa idade de aposentar. Eu queria – viu, Ministro? – que houvesse realmente um esforço concentrado para que a gente tenha realmente, eu digo, concurso, porque há uma proibição generalizada – como uma decisão sem levar em consideração que cada caso é um caso –, mas você não pode simplesmente suspender concurso de tudo. E aí os pesquisadores agora todos aposentando, não são como qualquer profissional que você anuncia e substitui no dia seguinte; há vários profissionais que você anuncia e substitui. Agora, para pesquisador levam-se dois, três anos para ter a transição de uma pesquisa nova.         Então, eu queria perguntar, primeiro, com relação a essa questão da informática, se tem resistência? Se o senhor acha que nessa gestão do senhor tem condição de a gente promover, de fato, a informatização? O Ministro Mandetta e outros anteriores não fizeram e me foi dito, inclusive, que há uma resistência grande. Não sei quem é que tem interesses diferentes, mas não tem lógica, no século XXI a gente estar ainda totalmente analógico. Mas, com relação à pesquisa, eu queria pedir a V. Exa. também que houvesse realmente uma aproximação maior entre a saúde, ciência, tecnologia e os institutos de pesquisa que são demandados. Então, eu vejo assim, é lamentável – no Brasil é assim –, cada ministério parece que é um governo diferente, cada secretaria estadual também parece que é um governo diferente, a educação não fala com a saúde, a saúde não fala com a cultura, lamentavelmente é assim. Então a gente precisa mudar isso, e a saúde, para nós, é escancaradamente sem controle, lamentavelmente. Eu fico, assim, abismado aqui no DF com a falta total de controle. Vocês vão ver, daqui a pouco, aprovamos já os requerimentos. A hora que começarmos a convocar e ver o processo, as pessoas não têm controle. As pessoas vendem para o governo, colocam um preço baixo, mas na hora de entregar entrega a metade, 70% do produto. Não tem controle com relação à atuação dos profissionais. O que custa hoje você digitalizar os exames, o prontuário? Na hora em que o médico vai atender o paciente, na hora em que abre o computador, tem lá tudo isso. É coisa simples de fazer, mas precisa ter vontade política de fazer, determinação para fazer. Então, eu gostaria de pedir que V. Sa. se empenhasse nisso. Eu tenho certeza de que vai dar mais dignidade às pessoas e vai reduzir a corrupção, o descontrole e a ineficiência do serviço de um modo geral na saúde. Era isso, Sr. Presidente. "
"1318","5","2021-05-06","MARCELO ANTÔNIO CARTAXO QUEIROGA LOPES","","","","","","Obrigado, Senador. "
"1319","5","2021-05-06","Omar Aziz","PRESIDENTE","(Omar Aziz. PSD - AM)","PSD","AM","","Obrigado, Senador. Senador Jean Paul. "
"1320","5","2021-05-06","JEAN PAUL PRATES","(Bloco Parlamentar da Resistência Democrática/PT - RN. Pela ordem.)","Bloco Parlamentar da Resistência Democrática","PT","RN","Pela ordem","Presidente, queria, inicialmente, até pedir, é quase como se fosse um pela ordem inicialmente, em relação à questão da visita que o inquirente Pazuello recebeu do Ministro Onyx. Saber de V. Exa. se tem alguma coisa que a gente possa fazer, porque, de fato, o Estado de S.Paulo revelou aqui que ele foi flagrado em foto chegando e saindo do hotel de trânsito de oficiais, onde mora o Pazuello, no Setor Militar Urbano aqui de Brasília. E, para quem está nos assistindo em casa, isso aqui é um inquérito parlamentar. Claro que todos nós aqui sabemos, mas se aplica – estou do lado de quem mais sabe desse assunto aqui na Casa, Delegado Contarato – o Regimento do Senado, mas, subsidiariamente, plenamente, o Código Penal e o Código de Processo Penal, e, no art. 342, está escrito: crime de falso testemunho, fazer afirmação falsa ou negar ou calar a verdade como testemunha. "
"1321","5","2021-05-06","Omar Aziz","PRESIDENTE","(Omar Aziz. PSD - AM)","PSD","AM","","Bom... "
"1322","5","2021-05-06","JEAN PAUL PRATES","(Bloco Parlamentar da Resistência Democrática/PT - RN)","Bloco Parlamentar da Resistência Democrática","PT","RN","","Então, essa primeira era uma questão de ordem, não faz parte da minha inquisição ainda, mas queria que V. Exa., depois de já ter sabido disso, está aqui a foto da visita publicada no jornal, saber o que a gente faz diante disso, é uma pergunta até. "
"1323","5","2021-05-06","Omar Aziz","PRESIDENTE","(Omar Aziz. PSD - AM)","PSD","AM","","Primeiro, torcer para o ex-Ministro Pazuello não estar com Covid e não contaminar o Onyx. "
"1324","5","2021-05-06","JEAN PAUL PRATES","(Bloco Parlamentar da Resistência Democrática/PT - RN)","Bloco Parlamentar da Resistência Democrática","PT","RN","","Com certeza.         "
"1325","5","2021-05-06","Omar Aziz","PRESIDENTE","(Omar Aziz. PSD - AM)","PSD","AM","","É a primeira coisa. A segunda: não foi o ex-Ministro Pazuello que foi ao Onyx. O Onyx que foi fazer uma visita. Isso é uma questão pessoal deles. Ninguém pode proibir alguém de visitar alguém mesmo que esteja com suspeita de Covid. Eu não tenho como... Nós não temos poder para isso. Agora, eu espero que, se o ex-Ministro Pazuello estiver com Covid, o Ministro Onyx não se contamine. Vamos torcer para isso. No mais, não podemos fazer mais nada. Vamos tocar... "
"1326","5","2021-05-06","RENAN CALHEIROS","(Bloco Parlamentar Unidos pelo Brasil/MDB - AL)","Bloco Parlamentar Unidos pelo Brasil","MDB","AL","","Presidente... "
"1327","5","2021-05-06","JEAN PAUL PRATES","(Bloco Parlamentar da Resistência Democrática/PT - RN)","Bloco Parlamentar da Resistência Democrática","PT","RN","","Vamos esperar que seja assim, que não seja apenas uma alegação... "
"1328","5","2021-05-06","RENAN CALHEIROS","(Bloco Parlamentar Unidos pelo Brasil/MDB - AL. Como Relator.)","Bloco Parlamentar Unidos pelo Brasil","MDB","AL","Como Relator","Sobre essa questão que foi levantada, eu acho que o Ministro Pazuello continua equivocado ao extremo. Nós o estamos tratando dignamente, como testemunha. Ele não é acusado de nada. Ele não é investigado. Então, a sutileza da vinda dele como testemunha é uma coisa muito mais digna, muito mais digna. Se ele estiver querendo vir só na condição de acusado, aí é uma outra questão. Nós não estamos pretendendo acusá-lo de nada absolutamente. E o Supremo Tribunal Federal estabelece gradações diferentes com relação à testemunha e com relação ao acusado. "
"1329","5","2021-05-06","Omar Aziz","PRESIDENTE","(Omar Aziz. PSD - AM)","PSD","AM","","Só um minutinho. "
"1330","5","2021-05-06","RENAN CALHEIROS","(Bloco Parlamentar Unidos pelo Brasil/MDB - AL)","Bloco Parlamentar Unidos pelo Brasil","MDB","AL","","Eu acho que ele continua completamente equivocado. "
