"","reuniao","data","nome","funcao_blocoPar","BlocoParl","partido","estado","complemento","fala"
"1","5","2021-05-06","Omar Aziz","PRESIDENTE","(Omar Aziz. PSD - AM. Fala da Presidência.)","PSD","AM","Fala da Presidência","Bom dia! Havendo número regimental, declaro aberta a 5ª Reunião da Comissão Parlamentar de Inquérito criada pelos Requerimentos 1.371 e 1.372, de 2021, para apurar as ações e omissões do Governo Federal no enfrentamento da pandemia da Covid-19, bem como as cometidas por administradores públicos federais, estaduais e municipais no trato com a coisa pública, durante a vigência da calamidade originada pela pandemia do coronavírus. A presente reunião destina-se às oitivas dos Srs. Marcelo Queiroga, Ministro da Saúde, e Antonio Barra Torres, Presidente da Anvisa. E há ainda requerimentos em pauta para apreciação. Eu quero comunicar: os Requerimentos aprovados nºs 139 a 143, de autoria do Senador Ciro Nogueira, mencionavam informações de Municípios de até 200 mil habitantes. Há um erro material, uma vez que a referência será somente a Municípios a partir de 200 mil habitantes. Nesse sentido, a Secretaria fará a devida retificação nesses requerimentos. Eu vou aguardar a chegada do... Ministro, por favor, desculpa.  Eu vou aguardar a chegada do Relator para que a gente inicie os trabalhos. Pois não? "
"2","5","2021-05-06","RANDOLFE RODRIGUES","(Bloco Parlamentar Senado Independente/REDE - AP. Pela ordem.)","Bloco Parlamentar Senado Independente","REDE","AP","Pela ordem","Estou com o Senador Tasso na linha, ele está pedindo uma questão de ordem antes de iniciar os trabalhos. "
"3","5","2021-05-06","Omar Aziz","PRESIDENTE","(Omar Aziz. PSD - AM)","PSD","AM","","Pois não. "
"4","5","2021-05-06","RANDOLFE RODRIGUES","(Bloco Parlamentar Senado Independente/REDE - AP)","Bloco Parlamentar Senado Independente","REDE","AP","","V. Exa. poderia passar para ele? "
"5","5","2021-05-06","Omar Aziz","PRESIDENTE","(Omar Aziz. PSD - AM)","PSD","AM","","Passo ao Senador Tasso Jereissati, por favor. Eu não o estou vendo no vídeo. Estou vendo Izalci, Marcos e Otto. Ah, estou vendo-o agora.         Senador Tasso, com a palavra, por favor. "
"6","5","2021-05-06","TASSO JEREISSATI","(Bloco Parlamentar PODEMOS/PSDB/PSL/PSDB - CE. Pela ordem. Por videoconferência.)","Bloco Parlamentar PODEMOS/PSDB/PSL","PSDB","CE","Pela ordem Por videoconferência","Presidente Omar Aziz, muito obrigado pela deferência. Eu gostaria de colocar que ontem o Presidente da República fez as declarações mais graves e sérias que eu já vi um Presidente da República do Brasil fazer, de que haveria... De que a pandemia, o coronavírus, poderia fazer parte de uma guerra química provinda da sua origem, evidentemente ele não fala o nome, mas da China. Isso é muito grave. Se nós estamos vivendo uma guerra química, é uma das piores situações mundiais desde a Segunda Guerra Mundial; se não, nós estamos fazendo uma injúria e uma calúnia contra o nosso maior fornecedor de vacinas neste momento. Eu gostaria de fazer um requerimento verbal agora, mas que estou enviando por escrito, para que convidássemos a Abin, o responsável pela Abin, para vir a esta Comissão e explicar essa questão de guerra química, se existe isso, se não existe, porque, se não existe, é um verdadeiro boicote intencional à compra de vacinas ou envio de vacinas da China. É esse o requerimento que eu vou apresentar e queria apresentar já verbalmente, Presidente. Muito obrigado. "
"7","5","2021-05-06","Omar Aziz","PRESIDENTE","(Omar Aziz. PSD - AM)","PSD","AM","","Com certeza o requerimento do Senador Tasso Jereissati será apreciado pela Comissão. Eu vou passar a palavra ao Senador Izalci, que também pede uma questão ordem aqui. Senador Izalci.  Eu não estou te ouvindo. O Senador Izalci, eu não estou conseguindo ouvi-lo. É lá nele ou é aqui?  Senador Izalci, é o seu computador aí. "
"8","5","2021-05-06","IZALCI LUCAS","(Bloco Parlamentar PODEMOS/PSDB/PSL/PSDB - DF)","Bloco Parlamentar PODEMOS/PSDB/PSL","PSDB","DF","","Não, eu estou no celular. Agora, Presidente, está ouvindo? "
"9","5","2021-05-06","Omar Aziz","PRESIDENTE","(Omar Aziz. PSD - AM)","PSD","AM","","Já estou ouvindo agora V. Exa. "
"10","5","2021-05-06","IZALCI LUCAS","(Bloco Parlamentar PODEMOS/PSDB/PSL/PSDB - DF. Pela ordem. Por videoconferência.)","Bloco Parlamentar PODEMOS/PSDB/PSL","PSDB","DF","Pela ordem Por videoconferência","Presidente, eu fiz uma questão de ordem que V. Exa. acatou, mas, de qualquer forma, o Senador Girão apresentou um requerimento, que é o item 47, o Requerimento 410. É só para reforçar a questão de ordem que V. Exa. já acatou, a questão é lá da 12ª Vara, está no item da pauta de hoje, o 47. Só para reforçar, para ficar aprovado o requerimento que V. Exa. acatou como questão de ordem. "
"11","5","2021-05-06","Omar Aziz","PRESIDENTE","(Omar Aziz. PSD - AM)","PSD","AM","","Já foi enviado, Senador Izalci. Já foi corrigida a vara que V. Exa. pediu. Nós já corrigimos, já enviamos, tá? "
"12","5","2021-05-06","IZALCI LUCAS","(Bloco Parlamentar PODEMOS/PSDB/PSL/PSDB - DF)","Bloco Parlamentar PODEMOS/PSDB/PSL","PSDB","DF","","Ótimo. Muito obrigado, Presidente. "
"13","5","2021-05-06","Omar Aziz","PRESIDENTE","(Omar Aziz. PSD - AM)","PSD","AM","","Alguém pediu aqui? "
"14","5","2021-05-06","REGUFFE","(Bloco Parlamentar PODEMOS/PSDB/PSL/PODEMOS - DF)","Bloco Parlamentar PODEMOS/PSDB/PSL","PODEMOS","DF","","Sr. Presidente... "
"15","5","2021-05-06","Omar Aziz","PRESIDENTE","(Omar Aziz. PSD - AM)","PSD","AM","","Pois não, Senador. "
"16","5","2021-05-06","REGUFFE","(Bloco Parlamentar PODEMOS/PSDB/PSL/PODEMOS - DF. Pela ordem.)","Bloco Parlamentar PODEMOS/PSDB/PSL","PODEMOS","DF","Pela ordem","Só uma pergunta. Eu sei que não membros falam após os titulares e após os suplentes, mas qual é o tempo que os não membros têm para questionamentos? "
"17","5","2021-05-06","Omar Aziz","PRESIDENTE","(Omar Aziz. PSD - AM)","PSD","AM","","É o mesmo tempo de todos, Senador, quinze minutos. Geralmente, está interagindo entre o Senador e o que nós estamos ouvindo. "
"18","5","2021-05-06","REGUFFE","(Bloco Parlamentar PODEMOS/PSDB/PSL/PODEMOS - DF)","Bloco Parlamentar PODEMOS/PSDB/PSL","PODEMOS","DF","","Quinze minutos. Muito obrigado. "
"19","5","2021-05-06","Omar Aziz","PRESIDENTE","(Omar Aziz. PSD - AM)","PSD","AM","","Quinze minutos. Geralmente, pergunta, responde; pergunta, responde. "
"20","5","2021-05-06","REGUFFE","(Bloco Parlamentar PODEMOS/PSDB/PSL/PODEMOS - DF)","Bloco Parlamentar PODEMOS/PSDB/PSL","PODEMOS","DF","","O.k., mas quinze minutos no total. "
"21","5","2021-05-06","Omar Aziz","PRESIDENTE","(Omar Aziz. PSD - AM)","PSD","AM","","É igual para todos. "
"22","5","2021-05-06","REGUFFE","(Bloco Parlamentar PODEMOS/PSDB/PSL/PODEMOS - DF)","Bloco Parlamentar PODEMOS/PSDB/PSL","PODEMOS","DF","","O.k. Muito obrigado. Eu vou tentar ser disciplinado, então. "
"23","5","2021-05-06","RANDOLFE RODRIGUES","(Bloco Parlamentar Senado Independente/REDE - AP)","Bloco Parlamentar Senado Independente","REDE","AP","","Presidente... "
"24","5","2021-05-06","Omar Aziz","PRESIDENTE","(Omar Aziz. PSD - AM)","PSD","AM","","Senador Randolfe Rodrigues. "
"25","5","2021-05-06","RANDOLFE RODRIGUES","(Bloco Parlamentar Senado Independente/REDE - AP. Pela ordem.)","Bloco Parlamentar Senado Independente","REDE","AP","Pela ordem","... só uma questão de ordem – uma questão de ordem mesmo –, que é sobre a ordem dos trabalhos nossos, Presidente. Presidente, veja, nós estamos em uma Comissão que trata do enfrentamento da pandemia, da Covid-19. "
"26","5","2021-05-06","Omar Aziz","PRESIDENTE","(Omar Aziz. PSD - AM)","PSD","AM","","Sim. "
"27","5","2021-05-06","RANDOLFE RODRIGUES","(Bloco Parlamentar Senado Independente/REDE - AP. Pela ordem.)","Bloco Parlamentar Senado Independente","REDE","AP","Pela ordem","São necessárias aqui nesta Comissão, por óbvio, todas as medidas de segurança, em especial aos membros desta que estão comparecendo ao Plenário da Comissão Parlamentar de Inquérito.         Então, eu queria sugerir a V. Exa. – é, inclusive, uma sugestão conjunta desta Presidência – que oficializássemos a S. Exa. o Presidente do Senado, o Senador Rodrigo Pacheco, para que fosse assegurado aos membros efetivos e suplentes desta Comissão o exame periódico, a periodicidade de exames em virtude da circunstância de todos nós estarmos neste ambiente da Comissão, frequentando este ambiente da Comissão diariamente e, além disso, porque a ampla maioria de nós estamos retornando para os nossos Estados em voos e retornando novamente para cá. Então, é só uma questão administrativa para que esta Presidência encaminhe à Presidência do Congresso Nacional para que sejam assegurados exames periódicos, semanalmente pelo menos, aos membros desta Comissão em proteção aos próprios membros, mas em proteção também às pessoas com quem temos tido contato. "
"28","5","2021-05-06","Omar Aziz","PRESIDENTE","(Omar Aziz. PSD - AM)","PSD","AM","","Sim, nós faremos isso imediatamente. Ontem eu e o Senador Randolfe, na hora em que o Presidente Rodrigo Pacheco estava presidindo a reunião, pedimos para ver se há condições de fazermos num ambiente um pouco maior, até porque há muita gente aqui, alguns convidados nossos precisam de alguns assessores para trabalhar. Solicitamos, e o Presidente ficou de ver a estrutura e nos dar uma posição. Eu, mais tarde, vou ligar para ele para saber como está o encaminhamento. Mas hoje, já preocupado com a questão de haver muita gente aqui dentro, nós procuramos o Presidente... "
"29","5","2021-05-06","EDUARDO BRAGA","(Bloco Parlamentar Unidos pelo Brasil/MDB - AM)","Bloco Parlamentar Unidos pelo Brasil","MDB","AM","","Presidente, posso intervir para contribuir, para colaborar? "
"30","5","2021-05-06","Omar Aziz","PRESIDENTE","(Omar Aziz. PSD - AM)","PSD","AM","","Pois não, Senador Eduardo. "
"31","5","2021-05-06","EDUARDO BRAGA","(Bloco Parlamentar Unidos pelo Brasil/MDB - AM. Pela ordem.)","Bloco Parlamentar Unidos pelo Brasil","MDB","AM","Pela ordem","É, me parece, Senador Randolfe, que a Presidência e a Vice-Presidência desta Comissão, neste próprio ambiente, já podem estabelecer algumas regras, como, por exemplo: o distanciamento entre os assessores pode ser bem maior do que o observado neste momento, porque temos um corredor bem maior. Portanto, se cada um de nós tiver a consciência de estabelecer o distanciamento necessário, nós já fazemos uma evolução bastante razoável diante das necessidades. Por exemplo, eu soube que o Corpo de Bombeiros está ocupando o Auditório Petrônio Portella por razões óbvias. Então, neste momento, o Auditório Petrônio Portella está ocupado, mas eu acho que, aqui dentro desta sala, se os Srs. Senadores concordam, dá para fazer um espaçamento. Aqui nós trabalhamos normalmente com três ou quatro vezes mais Senadores e assessores do que nós estamos trabalhando. O que não pode é os assessores ficarem colados uns nos outros quando nós estamos falando e tratando de um protocolo que deve ser atendido por todos os brasileiros. "
"32","5","2021-05-06","Omar Aziz","PRESIDENTE","(Omar Aziz. PSD - AM)","PSD","AM","","Eu vou pedir à Secretaria... "
"33","5","2021-05-06","CIRO NOGUEIRA","(Bloco Parlamentar Unidos pelo Brasil/PP - PI)","Bloco Parlamentar Unidos pelo Brasil","PP","PI","","Sr. Presidente... "
"34","5","2021-05-06","Omar Aziz","PRESIDENTE","(Omar Aziz. PSD - AM)","PSD","AM","","Só um minutinho, só para responder... Responder não, para contribuir. Vou pedir para a Secretaria da Mesa orientar os assessores que ficam aqui, até para ficarem... (Intervenção fora do microfone.) "
"35","5","2021-05-06","Omar Aziz","PRESIDENTE","(Omar Aziz. PSD - AM)","PSD","AM","","Não, não, é o distanciamento que todo mundo tem de fazer. Senador Ciro Nogueira, por favor. "
"36","5","2021-05-06","CIRO NOGUEIRA","(Bloco Parlamentar Unidos pelo Brasil/PP - PI. Pela ordem.)","Bloco Parlamentar Unidos pelo Brasil","PP","PI","Pela ordem","Peço que essa preocupação seja levada também não só aos Senadores e suplentes, mas aos nossos funcionários que estão aqui. "
"37","5","2021-05-06","RANDOLFE RODRIGUES","(Bloco Parlamentar Senado Independente/REDE - AP)","Bloco Parlamentar Senado Independente","REDE","AP","","É extensivo a todos. "
"38","5","2021-05-06","Omar Aziz","PRESIDENTE","(Omar Aziz. PSD - AM)","PSD","AM","","Não é só para os Senadores não, é para todos os servidores que estão aqui. "
"39","5","2021-05-06","RANDOLFE RODRIGUES","(Bloco Parlamentar Senado Independente/REDE - AP)","Bloco Parlamentar Senado Independente","REDE","AP","","A nossa preocupação é, inclusive, em relação a todos. "
"40","5","2021-05-06","Omar Aziz","PRESIDENTE","(Omar Aziz. PSD - AM)","PSD","AM","","É para todos eles, até porque, se um deles pegar, passa para a gente também. "
"41","5","2021-05-06","EDUARDO BRAGA","(Bloco Parlamentar Unidos pelo Brasil/MDB - AM)","Bloco Parlamentar Unidos pelo Brasil","MDB","AM","","E, Presidente, o senhor pode até pedir ao Presidente Rodrigo Pacheco que todos os nossos assessores e servidores façam semanalmente o teste rápido do PCR para que, semanalmente...         "
"42","5","2021-05-06","RANDOLFE RODRIGUES","(Bloco Parlamentar Senado Independente/REDE - AP)","Bloco Parlamentar Senado Independente","REDE","AP","","Me parece que já tem uma regulamentação, Senador Ciro e Senador Eduardo, por parte da Presidência da Casa, em relação aos servidores e assessores, de uma regularidade do teste. Pela frequência na CPI... Existe, obviamente, já uma regularidade a cada 14 dias. Pela frequência da CPI, nós poderíamos reduzir essa frequência para ser semanalmente. Nesses termos eu acho que é o requerimento que temos que fazer a S. Exa. o Presidente do Congresso. "
"43","5","2021-05-06","Omar Aziz","PRESIDENTE","(Omar Aziz. PSD - AM)","PSD","AM","","O Senador Tasso está com uma mão erguida. Senador Tasso Jereissati, V. Exa. quer falar alguma coisa? (Intervenção fora do microfone.) "
"44","5","2021-05-06","Omar Aziz","PRESIDENTE","(Omar Aziz. PSD - AM)","PSD","AM","","Ah, tá. Já é para o depoente. Ministro Queiroga, eu até peço desculpa, porque eu falava Ministro ""Quiroga"", e não é. Desculpa, é ""Marcelo Queiroga"". Eu vou passar ao nosso Relator... (Intervenção fora do microfone.) "
"45","5","2021-05-06","Omar Aziz","PRESIDENTE","(Omar Aziz. PSD - AM)","PSD","AM","","Ainda não. Desculpa. O senhor pretende fazer uma preliminar ou já quer que a gente possa... "
"46","5","2021-05-06","MARCELO ANTÔNIO CARTAXO QUEIROGA LOPES","","","","","","Posso fazer uma saudação aos Srs. Senadores. "
"47","5","2021-05-06","Omar Aziz","PRESIDENTE","(Omar Aziz. PSD - AM)","PSD","AM","","Eu queria que V. Exa... Com a palavra o Ministro Marcelo Queiroga. "
"48","5","2021-05-06","MARCELO ANTÔNIO CARTAXO QUEIROGA LOPES","(Para depor.)","(Para depor.)","(Para depor.)","(Para depor.)","(Para depor","Exmo. Sr. Senador Omar Aziz, Presidente desta Comissão Parlamentar de Inquérito; Exmo. Sr. Senador Renan Calheiros, ilustre Relator; Senador Randolfe Rodrigues, Vice-Presidente da Comissão; saúdo todos os demais Senadores em nome do Senador Ciro Nogueira. Não é a primeira vez que eu estou nesta Casa participando de uma audiência como esta, não de CPI, mas de audiências públicas. E, na outra oportunidade, nas duas outras oportunidades, essas audiências foram muito importantes para o nosso País. Agora, eu venho contribuir com os senhores na qualidade de Ministro de Estado da Saúde. Como todos sabemos, vivemos um momento especial da vida sanitária do mundo: a pandemia da Covid-19. "
"49","5","2021-05-06","Omar Aziz","PRESIDENTE","(Omar Aziz. PSD - AM. Fazendo soar a campainha.)","PSD","AM","Fazendo soar a campainha","Eu vou pedir para as pessoas fazerem um pouco de silêncio. O Ministro Marcelo Queiroga está aqui explanando. E eu, com o barulho que está aí de conversa, não estou ouvindo – nem eu que estou aqui do lado dele. "
"50","5","2021-05-06","ALESSANDRO VIEIRA","(Bloco Parlamentar Senado Independente/CIDADANIA - SE)","Bloco Parlamentar Senado Independente","CIDADANIA","SE","","Sr. Presidente... "
"51","5","2021-05-06","MARCELO ANTÔNIO CARTAXO QUEIROGA LOPES","","","","","","Obrigado, Senador. "
"52","5","2021-05-06","ALESSANDRO VIEIRA","(Bloco Parlamentar Senado Independente/CIDADANIA - SE. Pela ordem.)","Bloco Parlamentar Senado Independente","CIDADANIA","SE","Pela ordem","Só uma breve indagação: foi submetido ao compromisso de dizer a verdade o Sr. Ministro? "
"53","5","2021-05-06","Omar Aziz","PRESIDENTE","(Omar Aziz. PSD - AM)","PSD","AM","","Ainda não. "
"54","5","2021-05-06","ALESSANDRO VIEIRA","(Bloco Parlamentar Senado Independente/CIDADANIA - SE)","Bloco Parlamentar Senado Independente","CIDADANIA","SE","","Na condição de testemunha. "
"55","5","2021-05-06","Omar Aziz","PRESIDENTE","(Omar Aziz. PSD - AM)","PSD","AM","","Desculpa. Desculpa. Ministro, o senhor promete, sob a palavra de honra, nos termos do art. 203 do Código de Processo Penal, dizer a verdade do que souber e lhe for perguntado? "
"56","5","2021-05-06","MARCELO ANTÔNIO CARTAXO QUEIROGA LOPES","(Para depor.)","(Para depor.)","(Para depor.)","(Para depor.)","(Para depor","Sim, Sr. Senador. Esse é o nosso compromisso. "
"57","5","2021-05-06","Omar Aziz","PRESIDENTE","(Omar Aziz. PSD - AM)","PSD","AM","","A partir deste momento, o senhor está sob o compromisso de dizer a verdade, nos termos do art. 203 do Código de Processo Penal. Com a palavra V. Exa. "
