"","reuniao","data","nome","funcao_blocoPar","BlocoParl","partido","estado","complemento","fala"
"1","56","2021-09-21","Omar Aziz","PRESIDENTE","(Omar Aziz. PSD - AM. Fala da Presidência.)","PSD","AM","Fala da Presidência","Bom dia a todos! Havendo número regimental, declaro aberta a 56ª Reunião da Comissão Parlamentar de Inquérito, criada pelos Requerimentos 1.371 e 1.372, de 2021, para apurar as ações e omissões do Governo Federal no enfrentamento da pandemia da covid-19, bem como outras ações e omissões cometidas por administradores públicos federais, estaduais e municipais no trato com a coisa pública, durante a vigência da calamidade originada pela pandemia do coronavírus. A presente reunião destina-se ao depoimento do Ministro Wagner de Campos Rosário, em atendimento ao requerimento de autoria do Senador Eduardo Girão. Solicito que o depoente seja conduzido à mesa. 6  "
"2","56","2021-09-21","ROGÉRIO CARVALHO","(Bloco Parlamentar da Resistência Democrática/PT - SE. Pela ordem.)","Bloco Parlamentar da Resistência Democrática","PT","SE","Pela ordem","Presidente, na hora em que o depoente estiver à mesa, eu gostaria de fazer uma questão de ordem. "
"3","56","2021-09-21","HUMBERTO COSTA","(Bloco Parlamentar da Resistência Democrática/PT - PE)","Bloco Parlamentar da Resistência Democrática","PT","PE","","Eu queria, também nessa ocasião, pedir a palavra pela ordem, Sr. Presidente. "
"4","56","2021-09-21","Omar Aziz","PRESIDENTE","(Omar Aziz. PSD - AM)","PSD","AM","","O.k.  Primeiro, esclareço aos Senadores e ao Ministro que eu tinha pedido à Secretaria que comunicasse ao Ministro Wagner Rosário que nós iríamos atrasar e esperar o pronunciamento do Excelentíssimo Senhor Presidente da República e depois nós começaríamos a reunião. Então, não é um atraso em que o Ministro ficou aguardando aqui, porque eu pedi que se avisasse com antecedência a ele, para que não ficasse aguardando. Sr. Ministro, V. Sa. promete, sob a palavra de honra, nos termos do art. 203 do Código de Processo Penal, dizer a verdade do que souber e lhe for perguntado? "
"5","56","2021-09-21","WAGNER DE CAMPOS ROSÁRIO","(Para depor.)","(Para depor.)","(Para depor.)","(Para depor.)","(Para depor","Sim. "
"6","56","2021-09-21","Omar Aziz","PRESIDENTE","(Omar Aziz. PSD - AM)","PSD","AM","","A partir deste momento, V. Sa. está sujeito ao compromisso de dizer a verdade, nos termos do art. 203 do Código de Processo Penal. Eu quero aqui dizer que o Ministro não recorreu ao Supremo para estar nessa Comissão. Caso raro; praticamente quase todos aqueles que vieram aqui recorreram ao Supremo Tribunal Federal.         Então, eu parto do princípio de que o Ministro, naquilo que lhe for perguntado, responderá – até porque ele não procurou a Justiça para estar presente aqui. O Senador Rogério Carvalho pediu uma questão de ordem. Por favor, Senador. "
"7","56","2021-09-21","ROGÉRIO CARVALHO","(Bloco Parlamentar da Resistência Democrática/PT - SE. Para questão de ordem.)","Bloco Parlamentar da Resistência Democrática","PT","SE","Para questão de ordem","Sr. Presidente, solicito a presente questão de ordem com fundamento no art. 4º, inciso I, da Lei nº 1.579, de 1952, e no art. 412, inciso I, do Regimento Interno desta Casa. Ontem o Brasil assistiu estarrecido ao vídeo postado nas redes sociais por Jair Renan Bolsonaro, filho 04 do Presidente Bolsonaro. O vídeo contém ameaça velada aos trabalhos e aos membros desta Comissão Parlamentar de Inquérito. No vídeo, Jair Renan disse: ""Bom dia, rapaziada. Então, com vocês aí, melhor jeito de acordar: tomando um suquinho, comendo um pão de queijo e visitando a loja de um grande amigo meu aqui: Júnior. Sabe o que o cara vende? Arma, brinquedo"". Cumpre salientar que o mencionado estabelecimento comercial do amigo de Jair Renan vende não apenas armas de airsoft, mas também equipamentos letais. Sobre o vídeo, Jair Renan escreveu sua ameaça: ""Alô, CPI"", ou seja, mostrando pelo menos umas 12 pistolas, armas automáticas. Ao agir dessa forma, ele quis, obviamente, intimidar esta CPI, que levou luz sobre a troca de favores existente entre Jair Renan e o lobista da Precisa Medicamentos, Marconny Faria. A conduta de Jair Renan é inaceitável, pois numa República todos devem estar submetidos à lei, mesmo que sejam filhos do Presidente – esses devem dar exemplo, e não partir para ameaça, como ele fez à CPI, ou seja, tentando obstruir os trabalhos da CPI com ameaça aos seus membros. O art. 4º da Lei 1.579, de 1952, que trata das CPIs, estabelece que: Art. 4º Constitui crime: I - Impedir, ou tentar impedir, mediante violência, ameaça ou assuadas, o regular funcionamento de Comissão Parlamentar de Inquérito, ou o livre exercício das atribuições de qualquer dos seus membros. Ora, a conduta de Jair Renan Bolsonaro amolda-se com perfeição ao tipo penal. Por esse motivo, deve ele responder pela prática do grave crime praticado. Jair também ofende o inciso I do art. 412 do Regimento Interno, que prevê que é irregular qualquer ato que coíba a participação plena dos Senadores nas atividades legislativas. Diante dos fatos narrados, indago a V. Exa. quais medidas serão adotadas em face de Jair Renan Bolsonaro, que agiu para intimidar esta CPI, e sugiro encaminhamento de representação à Procuradoria-Geral da República, à Presidência do Senado, para que adotem as providências necessárias. Sr. Presidente, ele tem 19 anos. Um garoto de 18 anos, se cometer um crime, vai responder por isso. O fato de ele ter 19 anos já o habilita. Ele já tem todas as faculdades e todas as responsabilidades criminais.         Portanto, nós precisamos... Na condição dele, de filho do Presidente, deve servir de exemplo para todos aqueles que cometem atos de intimidação das instituições democráticas. E me parece que este é um traço familiar: agredir a democracia, o Estado democrático de direito e as instituições democráticas. É uma ameaça velada à CPI, aos membros da CPI. É importante dizer que eu também mandei para o Presidente do Senado a ameaça que sofremos por parte de algum dos seguidores do Presidente Bolsonaro que propôs e incitou a população a assassinar todos os membros do STF e a assassinar os membros do Partido dos Trabalhadores. E nós apresentamos essa denúncia, que foi feita em vídeo, ao Presidente do Senado. Então é uma questão que não pode deixar de ser discutida por esta Comissão Parlamentar de Inquérito, pela gravidade, primeiro, por se tratar do filho do Presidente, que tem que servir de exemplo. Ele teria que dar o exemplo de respeito às instituições, de respeito à democracia e ao Estado democrático de direito, e não fazer ameaças veladas, apresentando armas em loja de amigo dele, seja lá de quem for, mostrando que é na bala que ele vai se livrar daquilo que ele tem a responder perante a Justiça pelos possíveis delitos ou crimes que ele tenha cometido e que esta Comissão identificou. Muito obrigado, Sr. Presidente. "
"8","56","2021-09-21","RANDOLFE RODRIGUES","(PDT/CIDADANIA/REDE/REDE - AP. Pela ordem.)","(PDT/CIDADANIA/REDE/REDE - AP. Pela ordem.)","REDE","AP","Pela ordem","Presidente, só para completar: temos imagens da ameaça ontem proferida pelo rapaz contra a Comissão Parlamentar de Inquérito. Temos imagens, temos foto e temos o registro da empresa, da loja de armas de onde ele proferiu a ameaça aos membros da CPI. Só uma rápida divergência. O Sr. Jair Renan, o rapaz aí, o moço aí, ele não tem foro privilegiado. Então, não é necessário encaminhar à Procuradoria-Geral da República, Sr. Presidente. Comissão Parlamentar de Inquérito tem poder de investigação própria de autoridades policiais. Então, o encaminhamento que faço a V. Exa. é que o delegado de polícia ou a delegacia de polícia que estiver à disposição desta Comissão Parlamentar de Inquérito ouça o Sr. Jair Renan pelo crime de ameaça. Não precisa mandar à PGR, é uma simples queixa-crime por ameaça, que deve ser feita na delegacia mais próxima, para que o rapaz aí responda. Ele, embora seja filho do Presidente da República, não tem foro privilegiado; ele não tem nenhum tipo de foro privilegiado. Então, a primeira delegacia de polícia tem que constar. E temos aí a imagem da ameaça perpetrada pelo rapaz contra os membros desta Comissão Parlamentar de Inquérito. Eu requeiro a V. Exa. que nós possamos ver as imagens. Eu acho que as imagens falam por si. É muito importante. "
"9","56","2021-09-21","Omar Aziz","PRESIDENTE","(Omar Aziz. PSD - AM)","PSD","AM","","Esse jovem aí é o... É o Jair? "
"10","56","2021-09-21","RANDOLFE RODRIGUES","(PDT/CIDADANIA/REDE/REDE - AP)","(PDT/CIDADANIA/REDE/REDE - AP)","REDE","AP","","É o filho do Presidente da República. "
"11","56","2021-09-21","Omar Aziz","PRESIDENTE","(Omar Aziz. PSD - AM)","PSD","AM","","É esse rapaz? "
"12","56","2021-09-21","RANDOLFE RODRIGUES","(PDT/CIDADANIA/REDE/REDE - AP)","(PDT/CIDADANIA/REDE/REDE - AP)","REDE","AP","","Esse mesmo. É o filho do Presidente da República, que, inclusive, comparece, está presente nos diálogos do Marconny – o Sr. Relator sabe disso. Nos diálogos do Marconny. O Marconny, inclusive, confirmou aqui que tem uma relação próxima com ele. Talvez isso é que também o leve, talvez o pai dele, os membros da família dele a quererem ameaçar os membros desta Comissão Parlamentar de Inquérito. "
"13","56","2021-09-21","Omar Aziz","PRESIDENTE","(Omar Aziz. PSD - AM)","PSD","AM","","Sr. Ministro, é porque houve alguns fatos de ontem para hoje, e geralmente a gente debate sobre isso antes.         A gente tenta terminar a CPI, mas o pessoal do Governo não quer. Todo dia o Governo faz alguma coisa para a gente protelar a CPI. Na semana passada, o Ministro Queiroga, do nada, disse que não ia vacinar jovens e adolescentes, que hoje estão em sala de aula, estão aglomerados em sala de aula. E a gente conhece o jovem, o adolescente: ele, por natureza, não é disciplinado – é uma coisa natural. Criança tem indisciplina, não sabe, não tem noção do perigo. E muitos desses, caso não sejam vacinados, amanhã ou depois começam a adquirir o vírus dentro da escola, levando pra dentro de casa, para o avô, para a mãe, para o pai, para o tio, para o irmão. Por isso, há necessidade também, Ministro Queiroga, de essas crianças serem vacinadas. Baseado numa live, o Ministro Queiroga disse que parava a vacina naquele momento de uma forma... E contestado por médicos, profissionais, por uma série de pessoas, contestado pela Anvisa, contestado por profissionais que estão no conselho, no Conaes. Então, uma série de coisas... Aí dizem: ""Quando é que termina a CPI?"". Aí eu pergunto: quando o Governo parar de fazer tolice, porque eu não vou dizer mais que isso... Isso é tolice. Isso aí é uma tolice de um menino acha que pode tudo. "
"14","56","2021-09-21","RANDOLFE RODRIGUES","(PDT/CIDADANIA/REDE/REDE - AP)","(PDT/CIDADANIA/REDE/REDE - AP)","REDE","AP","","Presidente, inclusive, ele postou na rede social dele. "
"15","56","2021-09-21","Omar Aziz","PRESIDENTE","(Omar Aziz. PSD - AM)","PSD","AM","","Pois é. "
"16","56","2021-09-21","RANDOLFE RODRIGUES","(PDT/CIDADANIA/REDE/REDE - AP)","(PDT/CIDADANIA/REDE/REDE - AP)","REDE","AP","","No story do Instagram dele. "
"17","56","2021-09-21","Omar Aziz","PRESIDENTE","(Omar Aziz. PSD - AM)","PSD","AM","","Eu vou chamar isso de tolice – tolice maior. "
"18","56","2021-09-21","RANDOLFE RODRIGUES","(PDT/CIDADANIA/REDE/REDE - AP)","(PDT/CIDADANIA/REDE/REDE - AP)","REDE","AP","","Tolice, mas é crime – viu, Presidente? –, crime de ameaça. "
"19","56","2021-09-21","Omar Aziz","PRESIDENTE","(Omar Aziz. PSD - AM)","PSD","AM","","Sim, sim. Eu sei. Eu estou aqui dando uma de primeiro-ministro da Inglaterra, estou sendo xavequeiro, de uma forma mais brasileira do que inglesa: ""Tu já se vacinou? Toma a AstraZeneca."" E, aí, a pessoa cai na piadinha. Então, eu estou sendo aqui xavequeiro. E aí, no nosso linguajar no Amazonas, o que o Ministro Queiroga fez ontem foi dar ""cotoco"". Ele já tinha dado um ""cotoco"" para os jovens na semana passada, porque não queria que se vacinassem. E, aí, de uma forma eufórica, de um profissional que foi Presidente do conselho de cardiologia do Brasil, ele faz aquela cena deprimente para o tamanho que ele é, para o tamanho que ele é. Então, aí perguntam: ""Quando é que vai terminar a CPI?"". Eu não sei. Então, eu vou primeiro passar o vídeo, a sugestão, depois eu vou passar para... "
"20","56","2021-09-21","RANDOLFE RODRIGUES","(PDT/CIDADANIA/REDE/REDE - AP)","(PDT/CIDADANIA/REDE/REDE - AP)","REDE","AP","","Tem vídeo e foto, Presidente. "
"21","56","2021-09-21","Omar Aziz","PRESIDENTE","(Omar Aziz. PSD - AM)","PSD","AM","","Pois não, Senador. Eu passo a palavra para o Senador Marcos Rogério já, já. (Procede-se à exibição de vídeo.) "
"22","56","2021-09-21","RANDOLFE RODRIGUES","(PDT/CIDADANIA/REDE/REDE - AP)","(PDT/CIDADANIA/REDE/REDE - AP)","REDE","AP","","Embaixo está lá a advertência: ""Alô, CPI"". Agora, temos uma outra imagem, Presidente, inclusive com foto. "
"23","56","2021-09-21","Omar Aziz","PRESIDENTE","(Omar Aziz. PSD - AM)","PSD","AM","","Mas esse negócio... Sabe quem que tem esse linguajar? É marginal. Marginal é que chama arma de fogo de brinquedo: ""Olha o brinquedo aqui pra você"". É um marginal. Não é um jovem. "
"24","56","2021-09-21","RANDOLFE RODRIGUES","(PDT/CIDADANIA/REDE/REDE - AP)","(PDT/CIDADANIA/REDE/REDE - AP)","REDE","AP","","No Nordeste, é maloqueiro. Você sabe, não é, Renan? "
"25","56","2021-09-21","RENAN CALHEIROS","(Bloco Parlamentar Unidos pelo Brasil/MDB - AL)","Bloco Parlamentar Unidos pelo Brasil","MDB","AL","","Isso significa dizer que é mais um filho do Presidente que não recebeu educação dele. Essa ameaça é uma coisa estapafúrdia contra uma instituição parlamentar que, com todas as dificuldades que o Brasil vê, está fazendo a sua parte, cumprindo o seu papel.         Isso é uma coisa absurda, absurda sob qualquer aspecto! E essas ameaças de um fedelho como esse não vão intimidar, de forma nenhuma, essa Comissão Parlamentar de Inquérito. "
"26","56","2021-09-21","RANDOLFE RODRIGUES","(PDT/CIDADANIA/REDE/REDE - AP)","(PDT/CIDADANIA/REDE/REDE - AP)","REDE","AP","","Sr. Presidente, além da filmagem, da postagem no story do Instagram do rapaz, tem foto. Eu queria só pedir para colocar a foto também.  A foto está lá, olha, embaixo e o destaque lá: ""Alô, CPI!"", apontando pra arma. (Intervenção fora do microfone.) "
"27","56","2021-09-21","Omar Aziz","PRESIDENTE","(Omar Aziz. PSD - AM)","PSD","AM","","Olha, eu hoje, antes de... Eu, hoje de manhã, conversei com o Presidente Rodrigo Pacheco. Ele pediu pra comunicar aos Srs. Senadores e Senadoras que acompanham a CPI que ele está 100% solidário à CPI, que esse tipo de absurdo não pode acontecer e que ele está... Como Presidente do Senado, ele irá tomar todas as providências cabíveis em relação a esse tipo de ameaça que a CPI recebe. Então, Senador Rogério Carvalho, o Presidente, quando liguei pela manhã, já se posicionou em relação a isso, já se colocou, se solidarizou com os membros da CPI que sofrem esse tipo de ameaça. Parece... Pode parecer brincadeira, mas não é brincadeira isso. Senador Renan Calheiros. "
"28","56","2021-09-21","RENAN CALHEIROS","(Bloco Parlamentar Unidos pelo Brasil/MDB - AL)","Bloco Parlamentar Unidos pelo Brasil","MDB","AL","","Sr. Presidente, nós nos reunimos na última quinta-feira. De lá pra cá, aconteceram muitos fatos e eu considero importantíssimo que esses fatos sejam rememorados ou pelo menos vistos por esta Comissão Parlamentar de Inquérito como óbvios desdobramentos da apuração séria, isenta, independente que nós levamos a cabo nessa Comissão Parlamentar de Inquérito. Já vimos esse vídeo com ameaça, que não é velada; é uma ameaça explícita do filho do Presidente da República. Eu peço à Izabelle pra que nós possamos informar rapidamente à Comissão Parlamentar de Inquérito aspectos da distribuição de cloroquina para crianças no Brasil, que é uma coisa também terrível no exato momento em que o Ministro Queiroga defende, a pedido do Presidente da República, a suspensão da vacinação de adolescentes sem comorbidade. Por favor, rapidamente... "
"29","56","2021-09-21","ROGÉRIO CARVALHO","(Bloco Parlamentar da Resistência Democrática/PT - SE)","Bloco Parlamentar da Resistência Democrática","PT","SE","","Presidente, enquanto passa ali, eu queria só complementar a fala do Relator. O Presidente da República na ONU, hoje, além de fazer uma fala fake dizendo de realizações que são de outros governos e que ele quer assumir para si – porque ele faz tudo ao contrário –, ele defendeu o tratamento precoce outra vez na Conferência das Nações Unidas, reforçando a tarefa que o Queiroga cumpre, e a gente viu que, com toda a proximidade com o Presidente, porque é preciso ter aquela característica para ser Ministro do Presidente Jair Bolsonaro. "
"30","56","2021-09-21","RENAN CALHEIROS","(Bloco Parlamentar Unidos pelo Brasil/MDB - AL)","Bloco Parlamentar Unidos pelo Brasil","MDB","AL","","Nós vamos chegar lá, nós vamos chegar lá! "
"31","56","2021-09-21","RANDOLFE RODRIGUES","(PDT/CIDADANIA/REDE/REDE - AP)","(PDT/CIDADANIA/REDE/REDE - AP)","REDE","AP","","E falou que o auxílio emergencial era de US$800. Deve ser em algum outro país, em... "
"32","56","2021-09-21","RENAN CALHEIROS","(Bloco Parlamentar Unidos pelo Brasil/MDB - AL)","Bloco Parlamentar Unidos pelo Brasil","MDB","AL","","Lamentavelmente, em mais um triste espetáculo, o Presidente mentiu – a palavra é essa mesmo –, mentiu do começo ao fim do seu discurso. Mentiu vergonhosamente! Parecia que ele estava falando de um outro país que não era esse velho Brasil com as contradições que todos nós conhecemos. Por favor. "
"33","56","2021-09-21","Omar Aziz","PRESIDENTE","(Omar Aziz. PSD - AM)","PSD","AM","","E, pra quem achava que a CPI ia acabar em pizza, nós os vimos ontem degustando uma pizza na rua – na rua! Lá estava o representante da Nação brasileira, degustando uma pizza. Então, essa pizza não foi, para deixar bem claro, assada por nós da CPI. Não fomos nós quem fizemos essa pizza. Isso é uma pizza de outro país, a nossa não dará em pizza. Senador Marcos Rogério.         "
"34","56","2021-09-21","MARCOS ROGÉRIO","(Bloco Parlamentar Vanguarda/DEM - RO)","Bloco Parlamentar Vanguarda","DEM","RO","","Sr. Presidente... "
"35","56","2021-09-21","RENAN CALHEIROS","(Bloco Parlamentar Unidos pelo Brasil/MDB - AL)","Bloco Parlamentar Unidos pelo Brasil","MDB","AL","","Não, nós estamos esperando o vídeo. (Procede-se à exibição de vídeo.) "
"36","56","2021-09-21","RENAN CALHEIROS","(Bloco Parlamentar Unidos pelo Brasil/MDB - AL)","Bloco Parlamentar Unidos pelo Brasil","MDB","AL","","O nome do outro lá, não é? Eu peço, na sequência – coisa absolutamente escabrosa –, que se exiba rapidamente o vídeo do Ministro Queiroga, ontem, em Nova York. "
"37","56","2021-09-21","MARCOS ROGÉRIO","(Bloco Parlamentar Vanguarda/DEM - RO)","Bloco Parlamentar Vanguarda","DEM","RO","","Presidente, essa é a pauta da CPI do dia de hoje? "
"38","56","2021-09-21","RENAN CALHEIROS","(Bloco Parlamentar Unidos pelo Brasil/MDB - AL)","Bloco Parlamentar Unidos pelo Brasil","MDB","AL","","Estamos atualizando os assuntos da CPI agora. "
"39","56","2021-09-21","MARCOS ROGÉRIO","(Bloco Parlamentar Vanguarda/DEM - RO)","Bloco Parlamentar Vanguarda","DEM","RO","","Porque está parecendo o Jornal Nacional agora. (Procede-se à exibição de vídeo.) "
"40","56","2021-09-21","MARCOS ROGÉRIO","(Bloco Parlamentar Vanguarda/DEM - RO)","Bloco Parlamentar Vanguarda","DEM","RO","","Poxa, Presidente. "
"41","56","2021-09-21","RENAN CALHEIROS","(Bloco Parlamentar Unidos pelo Brasil/MDB - AL)","Bloco Parlamentar Unidos pelo Brasil","MDB","AL","","Havia pouca discrepância com relação à qualificação do Queiroga para comandar esse Ministério. "
"42","56","2021-09-21","MARCOS ROGÉRIO","(Bloco Parlamentar Vanguarda/DEM - RO)","Bloco Parlamentar Vanguarda","DEM","RO","","Olha, que a CPI está sendo instrumento de politicagem, todo mundo já sabe. Agora, fazer isso no expediente de trabalho da CPI, não, Presidente. "
"43","56","2021-09-21","RENAN CALHEIROS","(Bloco Parlamentar Unidos pelo Brasil/MDB - AL)","Bloco Parlamentar Unidos pelo Brasil","MDB","AL","","Agora, comandá-lo contra a ciência, para pôr em prática, materializar as ordens do Presidente da República, repetindo aquele outro que dizia ""um manda e o outro obedece""... "
"44","56","2021-09-21","MARCOS ROGÉRIO","(Bloco Parlamentar Vanguarda/DEM - RO)","Bloco Parlamentar Vanguarda","DEM","RO","","Se o Relator e outros querem fazer comentários, vá lá para a tribuna da imprensa e faça lá, mas não use o espaço da CPI para fazer isso. "
"45","56","2021-09-21","RANDOLFE RODRIGUES","(PDT/CIDADANIA/REDE/REDE - AP)","(PDT/CIDADANIA/REDE/REDE - AP)","REDE","AP","","Calma, Senador Marcos. Temos o dia todo hoje. Temos o dia todo, temos o dia todo. "
"46","56","2021-09-21","Omar Aziz","PRESIDENTE","(Omar Aziz. PSD - AM)","PSD","AM","","Não, mas esse é... "
"47","56","2021-09-21","HUMBERTO COSTA","(Bloco Parlamentar da Resistência Democrática/PT - PE)","Bloco Parlamentar da Resistência Democrática","PT","PE","","Eu pedi pela ordem. "
"48","56","2021-09-21","MARCOS ROGÉRIO","(Bloco Parlamentar Vanguarda/DEM - RO)","Bloco Parlamentar Vanguarda","DEM","RO","","Não, Presidente. Veja, nós temos um Ministro aqui que veio para prestar depoimento, aí a CPI começa a ser o palco do comentário geral da República. Isso não é investigação, Presidente. Isso não é investigação. "
"49","56","2021-09-21","Omar Aziz","PRESIDENTE","(Omar Aziz. PSD - AM)","PSD","AM","","Senador Marcos Rogério, a primeira questão que foi trazida aqui... "
"50","56","2021-09-21","MARCOS ROGÉRIO","(Bloco Parlamentar Vanguarda/DEM - RO)","Bloco Parlamentar Vanguarda","DEM","RO","","Essa é a opinião individual de cada um, eu só estou chamando o feito à ordem. "
"51","56","2021-09-21","Omar Aziz","PRESIDENTE","(Omar Aziz. PSD - AM)","PSD","AM","","Sim, sim. "
"52","56","2021-09-21","MARCOS ROGÉRIO","(Bloco Parlamentar Vanguarda/DEM - RO)","Bloco Parlamentar Vanguarda","DEM","RO","","Só isso. "
"53","56","2021-09-21","Omar Aziz","PRESIDENTE","(Omar Aziz. PSD - AM)","PSD","AM","","A primeira questão que foi trazida aqui é relativa diretamente à CPI, quando a CPI é ameaçada.          "
"54","56","2021-09-21","MARCOS ROGÉRIO","(Bloco Parlamentar Vanguarda/DEM - RO)","Bloco Parlamentar Vanguarda","DEM","RO","","Sobre isso eu quero falar, Sr. Presidente. Peço a palavra a V. Exa. "
"55","56","2021-09-21","HUMBERTO COSTA","(Bloco Parlamentar da Resistência Democrática/PT - PE. Fora do microfone.)","Bloco Parlamentar da Resistência Democrática","PT","PE","Fora do microfone","Depois de mim... "
"56","56","2021-09-21","Omar Aziz","PRESIDENTE","(Omar Aziz. PSD - AM)","PSD","AM","","Veja bem: ameaçada. E aí não somos nós que postamos esse vídeo, não, tá? Quem postou foi um jovem aí, que postou. Então, aí hoje já liguei para o Presidente, o Presidente se solidarizou – volto a repetir. E a outra questão é que nós estamos numa pandemia, e o Ministro Queiroga faz a gente passar vergonha fora... "
"57","56","2021-09-21","MARCOS ROGÉRIO","(Bloco Parlamentar Vanguarda/DEM - RO)","Bloco Parlamentar Vanguarda","DEM","RO","","A CPI está fazendo isso faz tempo, Presidente. "
"58","56","2021-09-21","Omar Aziz","PRESIDENTE","(Omar Aziz. PSD - AM)","PSD","AM","","Qual? "
"59","56","2021-09-21","MARCOS ROGÉRIO","(Bloco Parlamentar Vanguarda/DEM - RO)","Bloco Parlamentar Vanguarda","DEM","RO","","A CPI. "
"60","56","2021-09-21","Omar Aziz","PRESIDENTE","(Omar Aziz. PSD - AM)","PSD","AM","","Passar vergonha? "
"61","56","2021-09-21","MARCOS ROGÉRIO","(Bloco Parlamentar Vanguarda/DEM - RO)","Bloco Parlamentar Vanguarda","DEM","RO","","Isso. Ou V. Exa. acha que não? "
"62","56","2021-09-21","FABIANO CONTARATO","(PDT/CIDADANIA/REDE/REDE - ES)","(PDT/CIDADANIA/REDE/REDE - ES)","REDE","ES","","Senador, não faça isso, não! Tenha respeito aos Senadores. "
"63","56","2021-09-21","MARCOS ROGÉRIO","(Bloco Parlamentar Vanguarda/DEM - RO)","Bloco Parlamentar Vanguarda","DEM","RO","","Ou V. Exa. acha que não? "
"64","56","2021-09-21","FABIANO CONTARATO","(PDT/CIDADANIA/REDE/REDE - ES)","(PDT/CIDADANIA/REDE/REDE - ES)","REDE","ES","","Tenha respeito! "
"65","56","2021-09-21","MARCOS ROGÉRIO","(Bloco Parlamentar Vanguarda/DEM - RO)","Bloco Parlamentar Vanguarda","DEM","RO","","A CPI está fazendo isso desde o começo! "
"66","56","2021-09-21","FABIANO CONTARATO","(PDT/CIDADANIA/REDE/REDE - ES)","(PDT/CIDADANIA/REDE/REDE - ES)","REDE","ES","","Tenha respeito. "
"67","56","2021-09-21","Omar Aziz","PRESIDENTE","(Omar Aziz. PSD - AM)","PSD","AM","","Não... "
"68","56","2021-09-21","RENAN CALHEIROS","(Bloco Parlamentar Unidos pelo Brasil/MDB - AL. Como Relator.)","Bloco Parlamentar Unidos pelo Brasil","MDB","AL","Como Relator","A sabujice de Queiroga... "
"69","56","2021-09-21","FABIANO CONTARATO","(PDT/CIDADANIA/REDE/REDE - ES)","(PDT/CIDADANIA/REDE/REDE - ES)","REDE","ES","","O Governo, que V. Exa. apoia praticou o crime continuado... "
"70","56","2021-09-21","RANDOLFE RODRIGUES","(PDT/CIDADANIA/REDE/REDE - AP)","(PDT/CIDADANIA/REDE/REDE - AP)","REDE","AP","","A Precisa, que teve duas... (Tumulto no recinto.) "
"71","56","2021-09-21","FABIANO CONTARATO","(PDT/CIDADANIA/REDE/REDE - ES)","(PDT/CIDADANIA/REDE/REDE - ES)","REDE","ES","","... um Governo recheado de crimes... "
